2014/03/31,"['0', '0', '-5', '-1', '73', '54', '7', '1', '0', '0', '10', '57', '72', '11', '0', '1', '1', '8', '2', '7']",supported baseball 2014 preview american league outlook orioles verlander waiting season baltimore orioles completed set fairly underwhelming players added team baltimore wjz orioles start season day taking boston red sox javascript deferred var twitter delicious buzz aim var print var supported baseball 2014 preview american league outlook orioles verlander waiting season baltimore orioles completed set fairly underwhelming players added team baltimore wjz orioles start season day taking boston red sox javascript deferred var twitter delicious buzz aim var print var boston red sox starting pitcher jon lester throws baltimore orioles cal ripken 1981 2001 entire generation baseball fans included grew welcome 2014 season previews change format little trying stick relevant apr 2013 baltimore usa baltimore orioles players coaches line game 
2014/08/31,"['0', '0', '-1', '-1', '63', '66', '9', '0', '1', '0', '4', '67', '61', '12', '0', '1', '0', '7', '3', '4']",norfolk tides durham bulls steve johnson allowed runs innings tides friday night orioles beaten twins score chris davis hit grand norfolk tides durham bulls steve johnson allowed runs innings tides friday night orioles beaten twins score chris davis hit grand norfolk tides durham bulls game doubleheader supposed seven inning game supported baseball roundup braves push playoffs picks steam associated pressaug saturday night night wheeling dealing dan duquette following orioles victory aug 2014 baltimore usa baltimore orioles baseman steve pearce stretches 
2014/09/01,"['1', '1', '2', '-1', '36', '34', '8', '1', '2', '0', '8', '28', '44', '11', '0', '2', '0', '9', '7', '5']",norfolk tides durham bulls game doubleheader supposed seven inning game supported baseball roundup braves push playoffs picks steam associated pressaug saturday night night wheeling dealing dan duquette following orioles victory norfolk tides durham bulls game doubleheader supposed seven inning game supported baseball roundup braves push playoffs picks steam associated pressaug saturday night night wheeling dealing dan duquette following orioles victory aug 2014 baltimore usa baltimore orioles baseman steve pearce stretches aug 2014 baltimore usa baltimore orioles catcher caleb joseph hits 
2014/09/02,"['0', '1', '1', '1', '8', '8', '6', '0', '1', '0', '4', '10', '5', '5', '0', '1', '1', '10', '1', '2']",aug 2014 baltimore usa baltimore orioles baseman steve pearce stretches aug 2014 baltimore usa baltimore orioles baseman steve pearce stretches aug 2014 baltimore usa baltimore orioles catcher caleb joseph hits 
2014/09/03,"['0', '1', '1', '-1', '37', '26', '5', '0', '2', '0', '11', '36', '27', '7', '0', '1', '0', '13', '3', '2']",aug 2014 baltimore usa baltimore orioles catcher caleb joseph hits aug 2014 baltimore usa baltimore orioles catcher caleb joseph hits alejandro aza hits infield single inning cincinnati reds tuesday night sep 2014 baltimore usa baltimore orioles baseman jonathan schoop congratulated 
2014/09/04,"['1', '1', '1', '1', '33', '39', '10', '0', '3', '0', '10', '39', '34', '10', '0', '1', '0', '9', '3', '4']",alejandro aza hits infield single inning cincinnati reds tuesday night sep 2014 baltimore usa baltimore orioles baseman jonathan schoop congratulated photo joy absalon usa sportswith impressive win night orioles move sep 2014 baltimore usa baltimore orioles baseman chris davis singles baltimore orioles actually orioles incredibly team relied heavily ball seen orioles win valuable player award cal ripken time 1991 mike 
2014/09/05,"['1', '1', '3', '-1', '85', '59', '10', '0', '3', '1', '9', '63', '82', '8', '0', '1', '0', '7', '4', '1']",alejandro aza hits infield single inning cincinnati reds tuesday night sep 2014 baltimore usa baltimore orioles baseman jonathan schoop congratulated alejandro aza hits infield single inning cincinnati reds tuesday night sep 2014 baltimore usa baltimore orioles baseman jonathan schoop congratulated photo joy absalon usa sportswith impressive win night orioles move sep 2014 baltimore usa baltimore orioles baseman chris davis singles baltimore orioles actually orioles incredibly team relied heavily ball seen orioles win valuable player award cal ripken time 1991 mike sep 2014 baltimore usa baltimore orioles shortstop hardy hits game sep 2014 petersburg usa tampa bay rays shortstop yunel escobar supported baseball roundup hardy single lifts orioles past reds associated time week seeding currently stood angels orioles royals athletics mariners 
2014/09/06,"['1', '0', '-2', '1', '34', '28', '10', '0', '0', '0', '10', '31', '31', '6', '0', '0', '0', '7', '5', '3']",photo joy absalon usa sportswith impressive win night orioles move sep 2014 baltimore usa baltimore orioles baseman chris davis singles baltimore orioles actually orioles incredibly team relied heavily ball seen orioles win valuable player award cal ripken time 1991 mike photo joy absalon usa sportswith impressive win night orioles move sep 2014 baltimore usa baltimore orioles baseman chris davis singles baltimore orioles actually orioles incredibly team relied heavily ball seen orioles win valuable player award cal ripken time 1991 mike sep 2014 baltimore usa baltimore orioles shortstop hardy hits game sep 2014 petersburg usa tampa bay rays shortstop yunel escobar supported baseball roundup hardy single lifts orioles past reds associated time week seeding currently stood angels orioles royals athletics mariners sep 2014 baltimore usa baltimore orioles teammates celebrate game cincinnati tampa bay rays yunel escobar scores game winning run past tampa bay rays starter alex cobb pitches baltimore orioles inning tip cap wei yin chen night hashed time time pitching 
2014/09/07,"['1', '0', '-1', '1', '8', '7', '8', '0', '0', '1', '4', '8', '4', '7', '1', '2', '0', '5', '4', '3']",sep 2014 baltimore usa baltimore orioles shortstop hardy hits game sep 2014 petersburg usa tampa bay rays shortstop yunel escobar supported baseball roundup hardy single lifts orioles past reds associated time week seeding currently stood angels orioles royals athletics mariners sep 2014 baltimore usa baltimore orioles shortstop hardy hits game sep 2014 petersburg usa tampa bay rays shortstop yunel escobar supported baseball roundup hardy single lifts orioles past reds associated time week seeding currently stood angels orioles royals athletics mariners sep 2014 baltimore usa baltimore orioles teammates celebrate game cincinnati tampa bay rays yunel escobar scores game winning run past tampa bay rays starter alex cobb pitches baltimore orioles inning tip cap wei yin chen night hashed time time pitching aug 2014 baltimore usa baltimore orioles center fielder adam jones rays beat orioles game passed ball abc news yunel escobar umpire greg gibson baltimore orioles left fielder david lough left 
2014/09/08,"['1', '1', '1', '1', '3', '5', '6', '2', '0', '0', '9', '4', '4', '7', '1', '1', '0', '10', '3', '4']",sep 2014 baltimore usa baltimore orioles teammates celebrate game cincinnati tampa bay rays yunel escobar scores game winning run past tampa bay rays starter alex cobb pitches baltimore orioles inning tip cap wei yin chen night hashed time time pitching sep 2014 baltimore usa baltimore orioles teammates celebrate game cincinnati tampa bay rays yunel escobar scores game winning run past tampa bay rays starter alex cobb pitches baltimore orioles inning tip cap wei yin chen night hashed time time pitching aug 2014 baltimore usa baltimore orioles center fielder adam jones rays beat orioles game passed ball abc news yunel escobar umpire greg gibson baltimore orioles left fielder david lough left sitting division game lead september look monday afternoon bored left dylan bundy story orioles fans quick rehash bring speed considered baltimore orioles prayer winning yesterday lineup include names various regulars baltimore orioles steve pearce base boston red sox xander bogaerts 
2014/09/09,"['0', '0', '-8', '-1', '76', '78', '5', '3', '0', '0', '10', '74', '80', '8', '0', '0', '0', '4', '0', '8']",aug 2014 baltimore usa baltimore orioles center fielder adam jones rays beat orioles game passed ball abc news yunel escobar umpire greg gibson baltimore orioles left fielder david lough left aug 2014 baltimore usa baltimore orioles center fielder adam jones rays beat orioles game passed ball abc news yunel escobar umpire greg gibson baltimore orioles left fielder david lough left sitting division game lead september look monday afternoon bored left dylan bundy story orioles fans quick rehash bring speed considered baltimore orioles prayer winning yesterday lineup include names various regulars baltimore orioles steve pearce base boston red sox xander bogaerts orioles drafted adrian marin miami school third round 2012 draft 
2014/09/10,"['1', '1', '5', '-1', '29', '27', '17', '0', '2', '0', '7', '29', '29', '7', '0', '2', '0', '4', '8', '3']",sitting division game lead september look monday afternoon bored left dylan bundy story orioles fans quick rehash bring speed considered baltimore orioles prayer winning yesterday lineup include names various regulars baltimore orioles steve pearce base boston red sox xander bogaerts sitting division game lead september look monday afternoon bored left dylan bundy story orioles fans quick rehash bring speed considered baltimore orioles prayer winning yesterday lineup include names various regulars baltimore orioles steve pearce base boston red sox xander bogaerts orioles drafted adrian marin miami school third round 2012 draft sep 2014 boston usa baltimore orioles pitcher wei yin chen mandatory credit tommy gilligan usa sportsthe baltimore orioles continue hold 2012 mini wave profile signings cuba athletics inked yoenis cespedes watching red sox orioles beat wednesday afternoon peering mirror seeing 
2014/09/12,"['1', '1', '6', '1', '29', '36', '4', '0', '0', '0', '10', '33', '31', '9', '1', '1', '1', '8', '0', '6']",sep 2014 boston usa baltimore orioles pitcher wei yin chen mandatory credit tommy gilligan usa sportsthe baltimore orioles continue hold 2012 mini wave profile signings cuba athletics inked yoenis cespedes watching red sox orioles beat wednesday afternoon peering mirror seeing sep 2014 boston usa baltimore orioles pitcher wei yin chen mandatory credit tommy gilligan usa sportsthe baltimore orioles continue hold 2012 mini wave profile signings cuba athletics inked yoenis cespedes watching red sox orioles beat wednesday afternoon peering mirror seeing caleb joseph adam jones helped orioles june photo greg cooper victory hardly worthy referred boston massacre yesterday game score probably javascript deferred var twitter delicious buzz aim var print var ideally josh hart writers eager spring training stories file jumped days ago tyler options rotation playoff time playoff rotation five baltimore august chris davis baltimore orioles reacts striking inning minnesota jul 2014 baltimore usa york yankees shortstop derek jeter congratulates 
2014/09/13,"['1', '0', '-4', '-1', '44', '45', '10', '0', '0', '0', '0', '45', '44', '8', '1', '0', '0', '0', '3', '7']",caleb joseph adam jones helped orioles june photo greg cooper victory hardly worthy referred boston massacre yesterday game score probably javascript deferred var twitter delicious buzz aim var print var ideally josh hart writers eager spring training stories file jumped days ago tyler options rotation playoff time playoff rotation five caleb joseph adam jones helped orioles june photo greg cooper victory hardly worthy referred boston massacre yesterday game score probably javascript deferred var twitter delicious buzz aim var print var ideally josh hart writers eager spring training stories file jumped days ago tyler options rotation playoff time playoff rotation five baltimore august chris davis baltimore orioles reacts striking inning minnesota jul 2014 baltimore usa york yankees shortstop derek jeter congratulates supported baseball orioles yankees innings orioles yankees orioles lose chris sept sports xchange highlights friday major league baseball games giants 
2014/09/14,"['1', '1', '1', '-1', '65', '49', '5', '0', '1', '0', '8', '61', '55', '4', '0', '1', '1', '13', '2', '1']",baltimore august chris davis baltimore orioles reacts striking inning minnesota jul 2014 baltimore usa york yankees shortstop derek jeter congratulates baltimore august chris davis baltimore orioles reacts striking inning minnesota jul 2014 baltimore usa york yankees shortstop derek jeter congratulates supported baseball orioles yankees innings orioles yankees orioles lose chris sept sports xchange highlights friday major league baseball games giants supported baseball applause camden yards thorn baltimore orioles fans overlook tonight series finale york broadcast espn sunday night baseball dan sep 2014 baltimore usa baltimore orioles baseman steve pearce celebrates supported baseball yankees orioles yankees halt orioles dead david waldsteinsept javascript deferred var twitter delicious buzz aim var print var 
2014/09/15,"['1', '1', '3', '-1', '6', '5', '13', '1', '1', '0', '10', '7', '4', '7', '0', '0', '1', '8', '4', '1']",supported baseball orioles yankees innings orioles yankees orioles lose chris sept sports xchange highlights friday major league baseball games giants supported baseball orioles yankees innings orioles yankees orioles lose chris sept sports xchange highlights friday major league baseball games giants supported baseball applause camden yards thorn baltimore orioles fans overlook tonight series finale york broadcast espn sunday night baseball dan sep 2014 baltimore usa baltimore orioles baseman steve pearce celebrates supported baseball yankees orioles yankees halt orioles dead david waldsteinsept javascript deferred var twitter delicious buzz aim var print var sep 2014 baltimore usa baltimore orioles third baseman kelly johnson run baltimore orioles 2014 expectations prior season exceeded surprised forget monday september wei yin chen marcus stroman chen stroman stat night game quasi meaningless york perspective mathematically alive playoff spot supported baseball orioles yankees yankees grab lead ninth slips hands tonight derek jeter night baltimore classless orioles completely ruined pitchers 
2014/09/16,"['0', '0', '-2', '-1', '76', '79', '5', '1', '0', '1', '7', '75', '80', '8', '1', '1', '0', '8', '0', '2']",supported baseball applause camden yards thorn baltimore orioles fans overlook tonight series finale york broadcast espn sunday night baseball dan sep 2014 baltimore usa baltimore orioles baseman steve pearce celebrates supported baseball yankees orioles yankees halt orioles dead david waldsteinsept javascript deferred var twitter delicious buzz aim var print var supported baseball applause camden yards thorn baltimore orioles fans overlook tonight series finale york broadcast espn sunday night baseball dan sep 2014 baltimore usa baltimore orioles baseman steve pearce celebrates supported baseball yankees orioles yankees halt orioles dead david waldsteinsept javascript deferred var twitter delicious buzz aim var print var sep 2014 baltimore usa baltimore orioles third baseman kelly johnson run baltimore orioles 2014 expectations prior season exceeded surprised forget monday september wei yin chen marcus stroman chen stroman stat night game quasi meaningless york perspective mathematically alive playoff spot supported baseball orioles yankees yankees grab lead ninth slips hands tonight derek jeter night baltimore classless orioles completely ruined pitchers sep 2014 baltimore usa baltimore orioles clinch east championship game orioles selected hunter harvey 22nd overall pick 2013 draft name supported baseball clarity emerging playoff races wind baseball tyler kepner 
2014/09/17,"['0', '0', '-1', '1', '1', '2', '10', '1', '2', '1', '9', '2', '4', '6', '0', '1', '0', '9', '7', '6']",sep 2014 baltimore usa baltimore orioles third baseman kelly johnson run baltimore orioles 2014 expectations prior season exceeded surprised forget monday september wei yin chen marcus stroman chen stroman stat night game quasi meaningless york perspective mathematically alive playoff spot supported baseball orioles yankees yankees grab lead ninth slips hands tonight derek jeter night baltimore classless orioles completely ruined pitchers sep 2014 baltimore usa baltimore orioles third baseman kelly johnson run baltimore orioles 2014 expectations prior season exceeded surprised forget monday september wei yin chen marcus stroman chen stroman stat night game quasi meaningless york perspective mathematically alive playoff spot supported baseball orioles yankees yankees grab lead ninth slips hands tonight derek jeter night baltimore classless orioles completely ruined pitchers sep 2014 baltimore usa baltimore orioles clinch east championship game orioles selected hunter harvey 22nd overall pick 2013 draft name supported baseball clarity emerging playoff races wind baseball tyler kepner baltimore september nick hundley tommy hunter steve pearce baltimore orioles hard night title piece words justice witnessed night team stepped supported baseball roundup orioles lock east title nationals win east 
2014/09/19,"['1', '1', '16', '1', '22', '44', '6', '2', '1', '1', '7', '33', '31', '17', '1', '8', '0', '5', '3', '19']",baltimore september nick hundley tommy hunter steve pearce baltimore orioles hard night title piece words justice witnessed night team stepped supported baseball roundup orioles lock east title nationals win east baltimore september nick hundley tommy hunter steve pearce baltimore orioles hard night title piece words justice witnessed night team stepped supported baseball roundup orioles lock east title nationals win east photo bob dechiara usa sportsa day securing division title 1997 baltimore plans auditioning slugger final games season chris davis gone sep 2014 baltimore usa baltimore orioles manager buck showalter argues school roch showalter speaks quotes yesterday win else steve pearce add insult injury baltimore orioles decided earning series sweep toronto baltimore wjz orioles fever spreading streets baltimore fans gathered thursday orioles clinched east secured spot alds question remains opponent games sep 2014 baltimore usa baltimore orioles players celebrate clinching east game final regular season series camden yards tonight fireworks game baltimore orioles clinched american league east title division foe toronto 
2014/09/20,"['1', '1', '6', '-1', '71', '52', '12', '0', '3', '0', '7', '59', '66', '3', '0', '0', '0', '11', '8', '2']",photo bob dechiara usa sportsa day securing division title 1997 baltimore plans auditioning slugger final games season chris davis gone sep 2014 baltimore usa baltimore orioles manager buck showalter argues school roch showalter speaks quotes yesterday win else steve pearce add insult injury baltimore orioles decided earning series sweep toronto baltimore wjz orioles fever spreading streets baltimore fans gathered thursday orioles clinched east secured spot alds question remains opponent games photo bob dechiara usa sportsa day securing division title 1997 baltimore plans auditioning slugger final games season chris davis gone sep 2014 baltimore usa baltimore orioles manager buck showalter argues school roch showalter speaks quotes yesterday win else steve pearce add insult injury baltimore orioles decided earning series sweep toronto baltimore wjz orioles fever spreading streets baltimore fans gathered thursday orioles clinched east secured spot alds question remains opponent games sep 2014 baltimore usa baltimore orioles players celebrate clinching east game final regular season series camden yards tonight fireworks game baltimore orioles clinched american league east title division foe toronto sep 2014 baltimore usa baltimore orioles baseman christian walker singles supported beltway battle bipartisan dream washington baltimore world series jennifer baltimore orioles starting pitcher kevin gausman throws boston red sox 
2014/09/21,"['1', '0', '-2', '1', '76', '57', '9', '1', '3', '0', '4', '72', '61', '8', '0', '1', '0', '8', '5', '3']",sep 2014 baltimore usa baltimore orioles players celebrate clinching east game final regular season series camden yards tonight fireworks game baltimore orioles clinched american league east title division foe toronto sep 2014 baltimore usa baltimore orioles players celebrate clinching east game final regular season series camden yards tonight fireworks game baltimore orioles clinched american league east title division foe toronto sep 2014 baltimore usa baltimore orioles baseman christian walker singles supported beltway battle bipartisan dream washington baltimore world series jennifer baltimore orioles starting pitcher kevin gausman throws boston red sox adam jones hits homers lead baltimore orioles win boston red mar 2014 baltimore usa baltimore orioles left fielder nelson cruz baltimore evan meek relieved ryan webb base gotten impression matter 
2014/09/22,"['1', '0', '-3', '1', '30', '42', '15', '1', '1', '2', '14', '40', '30', '10', '2', '2', '0', '7', '10', '7']",sep 2014 baltimore usa baltimore orioles baseman christian walker singles supported beltway battle bipartisan dream washington baltimore world series jennifer baltimore orioles starting pitcher kevin gausman throws boston red sox sep 2014 baltimore usa baltimore orioles baseman christian walker singles supported beltway battle bipartisan dream washington baltimore world series jennifer baltimore orioles starting pitcher kevin gausman throws boston red sox adam jones hits homers lead baltimore orioles win boston red mar 2014 baltimore usa baltimore orioles left fielder nelson cruz baltimore evan meek relieved ryan webb base gotten impression matter sep 2014 baltimore usa baltimore orioles center fielder adam jones final regular season home game camden yards baltimore orioles hump week left baseball regular season playoff spots getting locked vegas 
2014/09/23,"['0', '0', '-4', '-1', '65', '70', '4', '0', '0', '0', '9', '77', '58', '10', '0', '1', '0', '9', '1', '5']",adam jones hits homers lead baltimore orioles win boston red mar 2014 baltimore usa baltimore orioles left fielder nelson cruz baltimore evan meek relieved ryan webb base gotten impression matter adam jones hits homers lead baltimore orioles win boston red mar 2014 baltimore usa baltimore orioles left fielder nelson cruz baltimore evan meek relieved ryan webb base gotten impression matter sep 2014 baltimore usa baltimore orioles center fielder adam jones final regular season home game camden yards baltimore orioles hump week left baseball regular season playoff spots getting locked vegas baltimore orioles starting pitcher wei yin chin reacts allowing fifth mandatory credit joy absalon usa sportssince city baltimore football baltimore 
2014/09/24,"['0', '0', '-3', '-1', '73', '53', '5', '1', '1', '0', '10', '56', '72', '9', '0', '2', '0', '7', '1', '4']",sep 2014 baltimore usa baltimore orioles center fielder adam jones final regular season home game camden yards baltimore orioles hump week left baseball regular season playoff spots getting locked vegas sep 2014 baltimore usa baltimore orioles center fielder adam jones final regular season home game camden yards baltimore orioles hump week left baseball regular season playoff spots getting locked vegas baltimore orioles starting pitcher wei yin chin reacts allowing fifth mandatory credit joy absalon usa sportssince city baltimore football baltimore sep 2014 bronx usa york yankees shortstop derek jeter reacts jones looks stretch singles doubles mandatory credit tommy gilligan usa sep 2014 bronx usa york yankees shortstop derek jeter reacts supported baseball orioles yankees orioles power surge pushes yankees brink 
2014/09/25,"['0', '1', '1', '1', '63', '43', '4', '0', '0', '0', '7', '60', '46', '6', '0', '1', '0', '5', '3', '4']",baltimore orioles starting pitcher wei yin chin reacts allowing fifth mandatory credit joy absalon usa sportssince city baltimore football baltimore baltimore orioles starting pitcher wei yin chin reacts allowing fifth mandatory credit joy absalon usa sportssince city baltimore football baltimore sep 2014 bronx usa york yankees shortstop derek jeter reacts jones looks stretch singles doubles mandatory credit tommy gilligan usa sep 2014 bronx usa york yankees shortstop derek jeter reacts supported baseball orioles yankees orioles power surge pushes yankees brink sep 2014 york usa york yankees shortstop derek jeter celebrates modicum sense history appreciated circumstances game tonight orioles fan yankees supported baseball orioles yankees yankees miss consecutive postseasons time decades 
