2014/03/31,"['0', '0', '-5', '-1', '73', '54', '7', '1', '0', '0', '10', '57', '72', '11', '0', '1', '1', '8', '2', '7']",supported baseball 2014 preview american league outlook orioles verlander waiting season baltimore orioles completed set fairly underwhelming players added team baltimore wjz orioles start season day taking boston red sox javascript deferred var twitter delicious buzz aim var print var supported baseball 2014 preview american league outlook orioles verlander waiting season baltimore orioles completed set fairly underwhelming players added team baltimore wjz orioles start season day taking boston red sox javascript deferred var twitter delicious buzz aim var print var boston red sox starting pitcher jon lester throws baltimore orioles cal ripken 1981 2001 entire generation baseball fans included grew welcome 2014 season previews change format little trying stick relevant apr 2013 baltimore usa baltimore orioles players coaches line game 
2014/05/31,"['0', '0', '-3', '1', '4', '1', '7', '0', '0', '1', '5', '0', '7', '6', '0', '0', '0', '8', '3', '0']",houston astros fielder george springer hits home run seventh inning 2014 houston usa baltimore orioles third baseman manny machado throws houston astros fielder george springer hits home run seventh inning 2014 houston usa baltimore orioles third baseman manny machado throws baltimore television radio personality mark viviano posed question nelson cruz 2014 houston usa baltimore orioles baseman chris davis umpire andy orioles losing game tonight look orioles minor league affiliates norfolk 2014 houston usa baltimore orioles manager buck showalter makes pitching norfolk tides pawtucket red sox kevin gausman started tides night saturday afternoon sought break mire game losing streak orioles discovered cruz hit major league leading 20th home run drove runs 2014 houston usa baltimore orioles manager buck showalter talks home wonder baltimore orioles trying disprove baseball times written starts pitching 
2014/06/01,"['0', '0', '-1', '1', '61', '61', '11', '0', '0', '0', '8', '62', '59', '5', '0', '1', '0', '9', '4', '3']",baltimore television radio personality mark viviano posed question nelson cruz 2014 houston usa baltimore orioles baseman chris davis umpire andy orioles losing game tonight look orioles minor league affiliates norfolk baltimore television radio personality mark viviano posed question nelson cruz 2014 houston usa baltimore orioles baseman chris davis umpire andy orioles losing game tonight look orioles minor league affiliates norfolk 2014 houston usa baltimore orioles manager buck showalter makes pitching norfolk tides pawtucket red sox kevin gausman started tides night saturday afternoon sought break mire game losing streak orioles discovered cruz hit major league leading 20th home run drove runs 2014 houston usa baltimore orioles manager buck showalter talks home wonder baltimore orioles trying disprove baseball times written starts pitching yesterday following friday night loss houston teams stretches lose games pawtucket red sox norfolk suk min yoon innings hits walks 
2014/06/03,"['0', '1', '5', '1', '39', '33', '7', '0', '2', '0', '8', '40', '28', '19', '1', '2', '0', '8', '6', '11']",yesterday following friday night loss houston teams stretches lose games pawtucket red sox norfolk suk min yoon innings hits walks yesterday following friday night loss houston teams stretches lose games pawtucket red sox norfolk suk min yoon innings hits walks norfolk tides pawtucket red sox tides top red sox prospect mandatory credit jerome miron usa sportslife minor leaguer hard numerous javascript deferred var twitter delicious buzz aim var print var javascript deferred var twitter delicious buzz aim var print var premier pitchers baseball star games third award received votes mvp nelson cruz getting hit wrist sunday victory houston baltimore orioles 
2014/06/04,"['0', '1', '8', '1', '61', '60', '7', '0', '2', '0', '5', '67', '53', '18', '1', '6', '0', '11', '5', '13']",norfolk tides pawtucket red sox tides top red sox prospect mandatory credit jerome miron usa sportslife minor leaguer hard numerous javascript deferred var twitter delicious buzz aim var print var javascript deferred var twitter delicious buzz aim var print var norfolk tides pawtucket red sox tides top red sox prospect mandatory credit jerome miron usa sportslife minor leaguer hard numerous javascript deferred var twitter delicious buzz aim var print var javascript deferred var twitter delicious buzz aim var print var premier pitchers baseball star games third award received votes mvp nelson cruz getting hit wrist sunday victory houston baltimore orioles norfolk scranton wilkes barre yankees tides ran lead starter josh jun 2014 arlington usa baltimore orioles starting pitcher ubaldo jimenez nelson cruz run missile night rbi half 110 june nights 
2014/06/05,"['0', '0', '-1', '-1', '12', '14', '6', '0', '2', '0', '6', '18', '11', '11', '0', '1', '0', '6', '3', '4']",premier pitchers baseball star games third award received votes mvp nelson cruz getting hit wrist sunday victory houston baltimore orioles premier pitchers baseball star games third award received votes mvp nelson cruz getting hit wrist sunday victory houston baltimore orioles norfolk scranton wilkes barre yankees tides ran lead starter josh jun 2014 arlington usa baltimore orioles starting pitcher ubaldo jimenez nelson cruz run missile night rbi half 110 june nights mandatory credit joy absalon usa sportsthe baltimore orioles draft pick photo robert deutsch usa sportsit erratic season orioles despite five 
2014/06/06,"['1', '0', '-3', '1', '70', '65', '7', '0', '0', '0', '10', '74', '62', '6', '1', '0', '0', '6', '5', '2']",norfolk scranton wilkes barre yankees tides ran lead starter josh jun 2014 arlington usa baltimore orioles starting pitcher ubaldo jimenez nelson cruz run missile night rbi half 110 june nights norfolk scranton wilkes barre yankees tides ran lead starter josh jun 2014 arlington usa baltimore orioles starting pitcher ubaldo jimenez nelson cruz run missile night rbi half 110 june nights mandatory credit joy absalon usa sportsthe baltimore orioles draft pick photo robert deutsch usa sportsit erratic season orioles despite five tenth round pick 2014 mlb draft orioles selected outfielder jay eighth round pick 2014 mlb draft orioles picked baseman steve 
2014/06/07,"['0', '1', '1', '-1', '76', '76', '7', '0', '2', '0', '7', '78', '74', '10', '0', '1', '0', '2', '5', '4']",mandatory credit joy absalon usa sportsthe baltimore orioles draft pick photo robert deutsch usa sportsit erratic season orioles despite five mandatory credit joy absalon usa sportsthe baltimore orioles draft pick photo robert deutsch usa sportsit erratic season orioles despite five tenth round pick 2014 mlb draft orioles selected outfielder jay eighth round pick 2014 mlb draft orioles picked baseman steve draft enthusiasm baltimore orioles fans recent memory cost signing free sports games inches evident football ten yards baseball game inches angry manny machado walks field dugouts emptied following machado tagged 
2014/06/08,"['0', '1', '9', '-1', '76', '62', '14', '1', '3', '0', '7', '58', '79', '8', '1', '1', '1', '7', '11', '2']",tenth round pick 2014 mlb draft orioles selected outfielder jay eighth round pick 2014 mlb draft orioles picked baseman steve tenth round pick 2014 mlb draft orioles selected outfielder jay eighth round pick 2014 mlb draft orioles picked baseman steve draft enthusiasm baltimore orioles fans recent memory cost signing free sports games inches evident football ten yards baseball game inches angry manny machado walks field dugouts emptied following machado tagged orioles finished 2014 draft saturday afternoon rounds players draft players 
2014/06/09,"['1', '1', '8', '1', '64', '67', '4', '2', '0', '0', '8', '74', '55', '14', '1', '5', '0', '4', '1', '9']",draft enthusiasm baltimore orioles fans recent memory cost signing free sports games inches evident football ten yards baseball game inches angry manny machado walks field dugouts emptied following machado tagged draft enthusiasm baltimore orioles fans recent memory cost signing free sports games inches evident football ten yards baseball game inches angry manny machado walks field dugouts emptied following machado tagged orioles finished 2014 draft saturday afternoon rounds players draft players cal ripken collegiate league 2014 season recently collegiate summer baseball 
2014/06/10,"['1', '1', '1', '-1', '1', '2', '8', '0', '1', '0', '9', '0', '1', '7', '1', '1', '0', '6', '3', '2']",orioles finished 2014 draft saturday afternoon rounds players draft players orioles finished 2014 draft saturday afternoon rounds players draft players cal ripken collegiate league 2014 season recently collegiate summer baseball jun 2014 baltimore usa benches baltimore orioles third baseman manny fourth pick 2012 draft baltimore orioles selected line anointed future results orioles week texas oakland boston scored runs allowed standings official announcement baltimore orioles major league baseball handed discipline manny jun 2014 baltimore usa baltimore orioles starting pitcher ubaldo jimenez 
2014/06/11,"['1', '1', '7', '1', '87', '73', '6', '0', '0', '0', '5', '79', '81', '15', '1', '1', '1', '7', '2', '9']",cal ripken collegiate league 2014 season recently collegiate summer baseball cal ripken collegiate league 2014 season recently collegiate summer baseball jun 2014 baltimore usa benches baltimore orioles third baseman manny fourth pick 2012 draft baltimore orioles selected line anointed future results orioles week texas oakland boston scored runs allowed standings official announcement baltimore orioles major league baseball handed discipline manny jun 2014 baltimore usa baltimore orioles starting pitcher ubaldo jimenez jun 2014 baltimore usa baltimore orioles third baseman manny machado benches manny machado takes exception inside pitch eighth inning sunday baltimore orioles manager buck showalter watches dugout inning baseball game javascript deferred var twitter delicious buzz aim var print var 
2014/06/12,"['0', '1', '3', '-1', '89', '73', '7', '0', '2', '0', '6', '84', '78', '10', '0', '1', '0', '8', '5', '2']",jun 2014 baltimore usa benches baltimore orioles third baseman manny fourth pick 2012 draft baltimore orioles selected line anointed future results orioles week texas oakland boston scored runs allowed standings official announcement baltimore orioles major league baseball handed discipline manny jun 2014 baltimore usa baltimore orioles starting pitcher ubaldo jimenez jun 2014 baltimore usa benches baltimore orioles third baseman manny fourth pick 2012 draft baltimore orioles selected line anointed future results orioles week texas oakland boston scored runs allowed standings official announcement baltimore orioles major league baseball handed discipline manny jun 2014 baltimore usa baltimore orioles starting pitcher ubaldo jimenez jun 2014 baltimore usa baltimore orioles third baseman manny machado benches manny machado takes exception inside pitch eighth inning sunday baltimore orioles manager buck showalter watches dugout inning baseball game javascript deferred var twitter delicious buzz aim var print var 
2014/06/13,"['1', '0', '-1', '-1', '73', '76', '9', '0', '1', '0', '12', '72', '77', '14', '2', '2', '1', '5', '6', '7']",jun 2014 baltimore usa baltimore orioles third baseman manny machado benches manny machado takes exception inside pitch eighth inning sunday baltimore orioles manager buck showalter watches dugout inning baseball game javascript deferred var twitter delicious buzz aim var print var jun 2014 baltimore usa baltimore orioles third baseman manny machado benches manny machado takes exception inside pitch eighth inning sunday baltimore orioles manager buck showalter watches dugout inning baseball game javascript deferred var twitter delicious buzz aim var print var little kid parents zoo baltimore various zoo exhibits invariably day 
2014/06/14,"['0', '0', '-2', '-1', '30', '28', '8', '3', '2', '1', '4', '30', '30', '13', '0', '1', '2', '7', '6', '8']",little kid parents zoo baltimore various zoo exhibits invariably day june sports xchange chicago cubs placed outfielder infielder emilio bonifacio jun 2014 baltimore usa baltimore orioles catcher caleb joseph speaks 
2014/06/15,"['0', '1', '2', '1', '61', '58', '6', '0', '1', '1', '8', '69', '50', '6', '0', '2', '0', '5', '3', '5']",little kid parents zoo baltimore various zoo exhibits invariably day little kid parents zoo baltimore various zoo exhibits invariably day june sports xchange chicago cubs placed outfielder infielder emilio bonifacio jun 2014 baltimore usa baltimore orioles catcher caleb joseph speaks norfolk syracuse nats edgmer escalona pitched nifty innings allowing hits jun 2014 baltimore usa baltimore orioles starting pitcher bud norris baltimore orioles center fielder adam jones celebrates baseman steve pearce 
2014/06/16,"['0', '1', '2', '1', '5', '3', '6', '0', '1', '1', '8', '3', '6', '9', '0', '1', '1', '9', '1', '3']",june sports xchange chicago cubs placed outfielder infielder emilio bonifacio jun 2014 baltimore usa baltimore orioles catcher caleb joseph speaks june sports xchange chicago cubs placed outfielder infielder emilio bonifacio jun 2014 baltimore usa baltimore orioles catcher caleb joseph speaks norfolk syracuse nats edgmer escalona pitched nifty innings allowing hits jun 2014 baltimore usa baltimore orioles starting pitcher bud norris baltimore orioles center fielder adam jones celebrates baseman steve pearce tampa bay rays yunel escobar reacts hitting home run baltimore tampa bay rays fielder jerry sands hits run home run brian matusz pitcher limited skill set ineffectiveness doing outside narrow 
2014/06/17,"['1', '1', '2', '1', '24', '27', '5', '1', '0', '0', '11', '25', '23', '9', '0', '2', '2', '8', '2', '4']",norfolk syracuse nats edgmer escalona pitched nifty innings allowing hits jun 2014 baltimore usa baltimore orioles starting pitcher bud norris baltimore orioles center fielder adam jones celebrates baseman steve pearce norfolk syracuse nats edgmer escalona pitched nifty innings allowing hits jun 2014 baltimore usa baltimore orioles starting pitcher bud norris baltimore orioles center fielder adam jones celebrates baseman steve pearce tampa bay rays yunel escobar reacts hitting home run baltimore tampa bay rays fielder jerry sands hits run home run brian matusz pitcher limited skill set ineffectiveness doing outside narrow jun 2014 petersburg usa baltimore orioles baseman steve pearce breaks solid middle relief pitcher appreciated player major league baseball team jun 2014 petersburg usa baltimore orioles baseman chris davis hits orioles perched lone game 500 mark exactly sort game lose 
2014/06/18,"['0', '1', '5', '1', '75', '71', '4', '0', '0', '1', '6', '88', '59', '8', '1', '0', '0', '12', '0', '5']",tampa bay rays yunel escobar reacts hitting home run baltimore tampa bay rays fielder jerry sands hits run home run brian matusz pitcher limited skill set ineffectiveness doing outside narrow tampa bay rays yunel escobar reacts hitting home run baltimore tampa bay rays fielder jerry sands hits run home run brian matusz pitcher limited skill set ineffectiveness doing outside narrow jun 2014 petersburg usa baltimore orioles baseman steve pearce breaks solid middle relief pitcher appreciated player major league baseball team jun 2014 petersburg usa baltimore orioles baseman chris davis hits orioles perched lone game 500 mark exactly sort game lose jun 2014 petersburg usa baltimore orioles fielder nick markakis center kevin gausman delivers third inning tampa bay rays tropicana field 
2014/06/20,"['0', '1', '3', '-1', '15', '12', '9', '1', '1', '0', '13', '12', '15', '4', '0', '0', '3', '6', '3', '0']",jun 2014 petersburg usa baltimore orioles fielder nick markakis center kevin gausman delivers third inning tampa bay rays tropicana field jun 2014 petersburg usa baltimore orioles fielder nick markakis center kevin gausman delivers third inning tampa bay rays tropicana field tony gwynn taped message speaking smokeless tobacco photo chris mcgrath javascript deferred var twitter delicious buzz aim var print var fans start count baltimore orioles recorded quality start games row york yankees fielder carlos beltran reacts heads home hitting run 
2014/06/21,"['1', '0', '-5', '1', '51', '54', '9', '0', '1', '2', '5', '53', '51', '4', '1', '1', '0', '5', '6', '1']",tony gwynn taped message speaking smokeless tobacco photo chris mcgrath javascript deferred var twitter delicious buzz aim var print var fans start count baltimore orioles recorded quality start games row tony gwynn taped message speaking smokeless tobacco photo chris mcgrath javascript deferred var twitter delicious buzz aim var print var fans start count baltimore orioles recorded quality start games row york yankees fielder carlos beltran reacts heads home hitting run rhp norris recall rhp meekbaltimore orioles pitcher bud norris delivers hardy nightmare finally eighth inning game home run drought blasted 
2014/06/22,"['0', '0', '-1', '-1', '42', '38', '5', '0', '0', '0', '5', '35', '42', '7', '1', '1', '0', '9', '0', '1']",york yankees fielder carlos beltran reacts heads home hitting run york yankees fielder carlos beltran reacts heads home hitting run rhp norris recall rhp meekbaltimore orioles pitcher bud norris delivers hardy nightmare finally eighth inning game home run drought blasted apr 2014 bronx usa baltimore orioles baseman jonathan schoop rounds orioles baseman steve pearce singles left inning york yankees yankee 
2014/06/23,"['1', '1', '2', '-1', '83', '59', '10', '1', '2', '0', '8', '69', '75', '12', '0', '4', '0', '13', '7', '5']",rhp norris recall rhp meekbaltimore orioles pitcher bud norris delivers hardy nightmare finally eighth inning game home run drought blasted rhp norris recall rhp meekbaltimore orioles pitcher bud norris delivers hardy nightmare finally eighth inning game home run drought blasted apr 2014 bronx usa baltimore orioles baseman jonathan schoop rounds orioles baseman steve pearce singles left inning york yankees yankee jun 2014 bronx usa baltimore orioles relief pitcher mcfarland catcher baseball top home run hitters meet time nelson cruz baltimore funny specific aspect victory heck game margin victory justifiably brett baltimore orioles pinch hitter chris davis hits game winning run 
2014/06/24,"['1', '1', '1', '1', '50', '53', '16', '2', '3', '0', '5', '52', '50', '11', '0', '2', '0', '12', '7', '8']",apr 2014 bronx usa baltimore orioles baseman jonathan schoop rounds orioles baseman steve pearce singles left inning york yankees yankee apr 2014 bronx usa baltimore orioles baseman jonathan schoop rounds orioles baseman steve pearce singles left inning york yankees yankee jun 2014 bronx usa baltimore orioles relief pitcher mcfarland catcher baseball top home run hitters meet time nelson cruz baltimore funny specific aspect victory heck game margin victory justifiably brett baltimore orioles pinch hitter chris davis hits game winning run supported baseball roundup benched start game davis rescues orioles associated season caleb joseph destined double bowie giving real prospects live jun 2014 baltimore usa baltimore orioles pinch hitter chris davis indianapolis pirates norfolk kevin gausman start live action session baltimore 
2014/06/25,"['0', '1', '6', '1', '5', '9', '6', '0', '1', '0', '15', '3', '11', '12', '2', '3', '0', '6', '3', '9']",jun 2014 bronx usa baltimore orioles relief pitcher mcfarland catcher baseball top home run hitters meet time nelson cruz baltimore funny specific aspect victory heck game margin victory justifiably brett baltimore orioles pinch hitter chris davis hits game winning run jun 2014 bronx usa baltimore orioles relief pitcher mcfarland catcher baseball top home run hitters meet time nelson cruz baltimore funny specific aspect victory heck game margin victory justifiably brett baltimore orioles pinch hitter chris davis hits game winning run supported baseball roundup benched start game davis rescues orioles associated season caleb joseph destined double bowie giving real prospects live jun 2014 baltimore usa baltimore orioles pinch hitter chris davis indianapolis pirates norfolk kevin gausman start live action session baltimore jun 2014 baltimore usa baltimore orioles pinch hitter delmon hits 
2014/06/27,"['1', '1', '2', '1', '37', '47', '8', '0', '0', '0', '5', '45', '39', '8', '1', '2', '0', '7', '4', '6']",jun 2014 baltimore usa baltimore orioles pinch hitter delmon hits jun 2014 baltimore usa baltimore orioles pinch hitter delmon hits javascript deferred var twitter delicious buzz aim var print var orioles series white sox win innings walk wild pitch white jun 2014 baltimore usa baltimore orioles designated hitter nelson cruz fans look game thinking baltimore orioles probably business winning easily 
2014/06/28,"['0', '1', '2', '-1', '26', '15', '5', '0', '1', '0', '7', '19', '24', '9', '0', '0', '0', '13', '3', '1']",javascript deferred var twitter delicious buzz aim var print var orioles series white sox win innings walk wild pitch white jun 2014 baltimore usa baltimore orioles designated hitter nelson cruz fans look game thinking baltimore orioles probably business winning easily javascript deferred var twitter delicious buzz aim var print var orioles series white sox win innings walk wild pitch white jun 2014 baltimore usa baltimore orioles designated hitter nelson cruz fans look game thinking baltimore orioles probably business winning easily jun 2014 baltimore usa baltimore orioles catcher nick hundley congratulated 
2014/06/29,"['0', '0', '-1', '1', '68', '88', '12', '0', '2', '1', '8', '93', '62', '6', '0', '0', '1', '8', '3', '2']",jun 2014 baltimore usa baltimore orioles catcher nick hundley congratulated jun 2014 baltimore usa baltimore orioles third baseman manny machado baltimore orioles pitcher miguel gonzalez delivers tampa bay rays inning 
2014/06/30,"['1', '1', '4', '1', '2', '6', '6', '2', '2', '0', '3', '6', '2', '13', '1', '1', '0', '12', '3', '7']",jun 2014 baltimore usa baltimore orioles catcher nick hundley congratulated jun 2014 baltimore usa baltimore orioles catcher nick hundley congratulated jun 2014 baltimore usa baltimore orioles third baseman manny machado baltimore orioles pitcher miguel gonzalez delivers tampa bay rays inning baltimore orioles third baseman manny machado singles seventh inning chicago next2 arrows mentionschris davis close expected leading mlb home runs baltimore orioles steve pearce congratulated nick markakis hitting run home jun 2014 baltimore usa baltimore orioles shortstop ryan flaherty celebrates 
2014/07/01,"['1', '1', '6', '1', '77', '73', '4', '1', '0', '1', '12', '91', '60', '8', '1', '2', '0', '10', '2', '8']",jun 2014 baltimore usa baltimore orioles third baseman manny machado baltimore orioles pitcher miguel gonzalez delivers tampa bay rays inning jun 2014 baltimore usa baltimore orioles third baseman manny machado baltimore orioles pitcher miguel gonzalez delivers tampa bay rays inning baltimore orioles third baseman manny machado singles seventh inning chicago next2 arrows mentionschris davis close expected leading mlb home runs baltimore orioles steve pearce congratulated nick markakis hitting run home jun 2014 baltimore usa baltimore orioles shortstop ryan flaherty celebrates june sports xchange manny machado five game suspension bat throwing orioles acquired bud norris houston astros nearly minute trade deadline 
2014/07/02,"['1', '1', '2', '-1', '10', '10', '12', '0', '4', '0', '12', '11', '10', '16', '0', '3', '0', '8', '10', '8']",baltimore orioles third baseman manny machado singles seventh inning chicago next2 arrows mentionschris davis close expected leading mlb home runs baltimore orioles steve pearce congratulated nick markakis hitting run home jun 2014 baltimore usa baltimore orioles shortstop ryan flaherty celebrates baltimore orioles third baseman manny machado singles seventh inning chicago next2 arrows mentionschris davis close expected leading mlb home runs baltimore orioles steve pearce congratulated nick markakis hitting run home jun 2014 baltimore usa baltimore orioles shortstop ryan flaherty celebrates june sports xchange manny machado five game suspension bat throwing orioles acquired bud norris houston astros nearly minute trade deadline jul 2014 baltimore usa texas rangers baseman rougned odor base supported baseball mighty east dream baseball tyler kepner july 2014 spot starts bullpen sometimes tend humble teams heck night orioles 
2014/07/03,"['1', '1', '1', '-1', '96', '66', '5', '1', '1', '0', '8', '83', '79', '6', '0', '0', '1', '4', '1', '0']",june sports xchange manny machado five game suspension bat throwing orioles acquired bud norris houston astros nearly minute trade deadline june sports xchange manny machado five game suspension bat throwing orioles acquired bud norris houston astros nearly minute trade deadline jul 2014 baltimore usa texas rangers baseman rougned odor base supported baseball mighty east dream baseball tyler kepner july 2014 spot starts bullpen sometimes tend humble teams heck night orioles photo rick osentoski usa sportsit little hard believe season orioles jul 2014 baltimore usa baltimore orioles third baseman ryan flaherty baltimore orioles adam jones singles seventh inning baseball game texas orioles pitcher major league debut wednesday night miles mikolas rangers ryan flaherty hits solo home run seventh inning texas rangers 
