2014/09/14,"['1', '1', '1', '-1', '65', '49', '5', '0', '1', '0', '8', '61', '55', '4', '0', '1', '1', '13', '2', '1']",baltimore august chris davis baltimore orioles reacts striking inning minnesota twins oriole park camden yards august 2014 baltimore maryland patrick jul 2014 baltimore usa york yankees shortstop derek jeter congratulates left fielder brett gardner hit home run inning baltimore orioles baltimore august chris davis baltimore orioles reacts striking inning minnesota twins oriole park camden yards august 2014 baltimore maryland patrick jul 2014 baltimore usa york yankees shortstop derek jeter congratulates left fielder brett gardner hit home run inning baltimore orioles supported baseball orioles yankees innings orioles yankees orioles lose chris davis drug suspension edging yankees david waldsteinsept 2014 continue reading sept sports xchange highlights friday major league baseball games giants dodgers bumgarner earned share major league lead 18th win san supported baseball applause camden yards thorn baltimore orioles fans overlook rivalry honor derek jeter sports times juliet macur sept 2014 tonight series finale york broadcast espn sunday night baseball dan shulman john kruk town handle play play color commentary huge sep 2014 baltimore usa baltimore orioles baseman steve pearce celebrates hardy hitting solo home run sixth inning york yankees oriole supported baseball yankees orioles yankees halt orioles dead david waldsteinsept 2014 continue reading main story share page continue reading main javascript deferred var twitter delicious buzz aim var print var javascript deferred editorial view age 200 national anthem speaks nation 
2014/09/15,"['1', '1', '3', '-1', '6', '5', '13', '1', '1', '0', '10', '7', '4', '7', '0', '0', '1', '8', '4', '1']",supported baseball orioles yankees innings orioles yankees orioles lose chris davis drug suspension edging yankees david waldsteinsept 2014 continue reading sept sports xchange highlights friday major league baseball games giants dodgers bumgarner earned share major league lead 18th win san supported baseball orioles yankees innings orioles yankees orioles lose chris davis drug suspension edging yankees david waldsteinsept 2014 continue reading sept sports xchange highlights friday major league baseball games giants dodgers bumgarner earned share major league lead 18th win san supported baseball applause camden yards thorn baltimore orioles fans overlook rivalry honor derek jeter sports times juliet macur sept 2014 tonight series finale york broadcast espn sunday night baseball dan shulman john kruk town handle play play color commentary huge sep 2014 baltimore usa baltimore orioles baseman steve pearce celebrates hardy hitting solo home run sixth inning york yankees oriole supported baseball yankees orioles yankees halt orioles dead david waldsteinsept 2014 continue reading main story share page continue reading main javascript deferred var twitter delicious buzz aim var print var javascript deferred editorial view age 200 national anthem speaks nation sep 2014 baltimore usa baltimore orioles third baseman kelly johnson mobbed teammates hitting game winning run double ninth inning york run baltimore orioles 2014 expectations prior season exceeded surprised forget players amazing currently games 500 top starting catcher matt wieters monday september wei yin chen marcus stroman chen stroman stat 2013 ytd 2013 ytd 137 168 114 era fip avg night game quasi meaningless york perspective mathematically alive playoff spot play game look math stands reason near baltimore orioles hand supported baseball orioles yankees yankees grab lead ninth slips hands david waldsteinsept 2014 continue reading main story share page continue tonight derek jeter night baltimore classless orioles completely ruined pitchers actually tried jeter instead letting reach base living legend night 
2014/09/16,"['0', '0', '-2', '-1', '76', '79', '5', '1', '0', '1', '7', '75', '80', '8', '1', '1', '0', '8', '0', '2']",supported baseball applause camden yards thorn baltimore orioles fans overlook rivalry honor derek jeter sports times juliet macur sept 2014 tonight series finale york broadcast espn sunday night baseball dan shulman john kruk town handle play play color commentary huge sep 2014 baltimore usa baltimore orioles baseman steve pearce celebrates hardy hitting solo home run sixth inning york yankees oriole supported baseball yankees orioles yankees halt orioles dead david waldsteinsept 2014 continue reading main story share page continue reading main javascript deferred var twitter delicious buzz aim var print var javascript deferred editorial view age 200 national anthem speaks nation supported baseball applause camden yards thorn baltimore orioles fans overlook rivalry honor derek jeter sports times juliet macur sept 2014 tonight series finale york broadcast espn sunday night baseball dan shulman john kruk town handle play play color commentary huge sep 2014 baltimore usa baltimore orioles baseman steve pearce celebrates hardy hitting solo home run sixth inning york yankees oriole supported baseball yankees orioles yankees halt orioles dead david waldsteinsept 2014 continue reading main story share page continue reading main javascript deferred var twitter delicious buzz aim var print var javascript deferred editorial view age 200 national anthem speaks nation sep 2014 baltimore usa baltimore orioles third baseman kelly johnson mobbed teammates hitting game winning run double ninth inning york run baltimore orioles 2014 expectations prior season exceeded surprised forget players amazing currently games 500 top starting catcher matt wieters monday september wei yin chen marcus stroman chen stroman stat 2013 ytd 2013 ytd 137 168 114 era fip avg night game quasi meaningless york perspective mathematically alive playoff spot play game look math stands reason near baltimore orioles hand supported baseball orioles yankees yankees grab lead ninth slips hands david waldsteinsept 2014 continue reading main story share page continue tonight derek jeter night baltimore classless orioles completely ruined pitchers actually tried jeter instead letting reach base living legend night sep 2014 baltimore usa baltimore orioles clinch east championship game toronto blue jays oriole park camden yards orioles defeated jays orioles selected hunter harvey 22nd overall pick 2013 draft name board exactly diamond rough late round pick harvey seen consensus supported baseball clarity emerging playoff races wind baseball tyler kepner sept 2014 continue reading main story share page continue reading 
2014/09/17,"['0', '0', '-1', '1', '1', '2', '10', '1', '2', '1', '9', '2', '4', '6', '0', '1', '0', '9', '7', '6']",sep 2014 baltimore usa baltimore orioles third baseman kelly johnson mobbed teammates hitting game winning run double ninth inning york run baltimore orioles 2014 expectations prior season exceeded surprised forget players amazing currently games 500 top starting catcher matt wieters monday september wei yin chen marcus stroman chen stroman stat 2013 ytd 2013 ytd 137 168 114 era fip avg night game quasi meaningless york perspective mathematically alive playoff spot play game look math stands reason near baltimore orioles hand supported baseball orioles yankees yankees grab lead ninth slips hands david waldsteinsept 2014 continue reading main story share page continue tonight derek jeter night baltimore classless orioles completely ruined pitchers actually tried jeter instead letting reach base living legend night sep 2014 baltimore usa baltimore orioles third baseman kelly johnson mobbed teammates hitting game winning run double ninth inning york run baltimore orioles 2014 expectations prior season exceeded surprised forget players amazing currently games 500 top starting catcher matt wieters monday september wei yin chen marcus stroman chen stroman stat 2013 ytd 2013 ytd 137 168 114 era fip avg night game quasi meaningless york perspective mathematically alive playoff spot play game look math stands reason near baltimore orioles hand supported baseball orioles yankees yankees grab lead ninth slips hands david waldsteinsept 2014 continue reading main story share page continue tonight derek jeter night baltimore classless orioles completely ruined pitchers actually tried jeter instead letting reach base living legend night sep 2014 baltimore usa baltimore orioles clinch east championship game toronto blue jays oriole park camden yards orioles defeated jays orioles selected hunter harvey 22nd overall pick 2013 draft name board exactly diamond rough late round pick harvey seen consensus supported baseball clarity emerging playoff races wind baseball tyler kepner sept 2014 continue reading main story share page continue reading baltimore september nick hundley tommy hunter steve pearce baltimore orioles celebrate field orioles clinch american league east division baseball game hard night title piece words justice witnessed night team stepped time crowned champions east champions exact baltimore orioles themselves people supported baseball roundup orioles lock east title nationals win east associated presssept 2014 continue reading main story share page continue 
2014/09/19,"['1', '1', '16', '1', '22', '44', '6', '2', '1', '1', '7', '33', '31', '17', '1', '8', '0', '5', '3', '19']",baltimore september nick hundley tommy hunter steve pearce baltimore orioles celebrate field orioles clinch american league east division baseball game hard night title piece words justice witnessed night team stepped time crowned champions east champions exact baltimore orioles themselves people supported baseball roundup orioles lock east title nationals win east associated presssept 2014 continue reading main story share page continue baltimore september nick hundley tommy hunter steve pearce baltimore orioles celebrate field orioles clinch american league east division baseball game hard night title piece words justice witnessed night team stepped time crowned champions east champions exact baltimore orioles themselves people supported baseball roundup orioles lock east title nationals win east associated presssept 2014 continue reading main story share page continue photo bob dechiara usa sportsa day securing division title 1997 orioles fans excitement organization promoted top hitting prospect christian walker baltimore plans auditioning slugger final games season chris davis gone remainder season baltimore orioles decided call base prospect christian walker sep 2014 baltimore usa baltimore orioles manager buck showalter argues umpire ted barrett sixth inning game toronto blue jays oriole school roch showalter speaks quotes yesterday win else steve pearce steve melewski pearce walker norris comment beat blue jaysmore game add insult injury baltimore orioles decided earning series sweep toronto night victory doing post season hopes division rival grasp suspect baltimore wjz orioles fever spreading streets baltimore fans gathered thursday won stop rallies fans pumped playoff action days team clinched orioles clinched east secured spot alds question remains opponent games angels record league assuming leapfrog angels winner central remains close sep 2014 baltimore usa baltimore orioles players celebrate clinching east title game toronto blue jays oriole park camden yards orioles game final regular season series camden yards tonight fireworks game concludes saturday giveaway orioles knit cap 000 age actually looks baltimore orioles clinched american league east title division foe toronto blue jays september 1997 birds onto defeat seattle mariners alds 
2014/09/20,"['1', '1', '6', '-1', '71', '52', '12', '0', '3', '0', '7', '59', '66', '3', '0', '0', '0', '11', '8', '2']",photo bob dechiara usa sportsa day securing division title 1997 orioles fans excitement organization promoted top hitting prospect christian walker baltimore plans auditioning slugger final games season chris davis gone remainder season baltimore orioles decided call base prospect christian walker sep 2014 baltimore usa baltimore orioles manager buck showalter argues umpire ted barrett sixth inning game toronto blue jays oriole school roch showalter speaks quotes yesterday win else steve pearce steve melewski pearce walker norris comment beat blue jaysmore game add insult injury baltimore orioles decided earning series sweep toronto night victory doing post season hopes division rival grasp suspect baltimore wjz orioles fever spreading streets baltimore fans gathered thursday won stop rallies fans pumped playoff action days team clinched orioles clinched east secured spot alds question remains opponent games angels record league assuming leapfrog angels winner central remains close photo bob dechiara usa sportsa day securing division title 1997 orioles fans excitement organization promoted top hitting prospect christian walker baltimore plans auditioning slugger final games season chris davis gone remainder season baltimore orioles decided call base prospect christian walker sep 2014 baltimore usa baltimore orioles manager buck showalter argues umpire ted barrett sixth inning game toronto blue jays oriole school roch showalter speaks quotes yesterday win else steve pearce steve melewski pearce walker norris comment beat blue jaysmore game add insult injury baltimore orioles decided earning series sweep toronto night victory doing post season hopes division rival grasp suspect baltimore wjz orioles fever spreading streets baltimore fans gathered thursday won stop rallies fans pumped playoff action days team clinched orioles clinched east secured spot alds question remains opponent games angels record league assuming leapfrog angels winner central remains close sep 2014 baltimore usa baltimore orioles players celebrate clinching east title game toronto blue jays oriole park camden yards orioles game final regular season series camden yards tonight fireworks game concludes saturday giveaway orioles knit cap 000 age actually looks baltimore orioles clinched american league east title division foe toronto blue jays september 1997 birds onto defeat seattle mariners alds sep 2014 baltimore usa baltimore orioles baseman christian walker singles inning boston red sox oriole park camden yards mandatory credit supported beltway battle bipartisan dream washington baltimore world series jennifer steinhauersept 2014 continue reading main story share page continue reading baltimore orioles starting pitcher kevin gausman throws boston red sox inning baseball game friday sept 2014 baltimore photo patrick semansky 
2014/09/21,"['1', '0', '-2', '1', '76', '57', '9', '1', '3', '0', '4', '72', '61', '8', '0', '1', '0', '8', '5', '3']",sep 2014 baltimore usa baltimore orioles players celebrate clinching east title game toronto blue jays oriole park camden yards orioles game final regular season series camden yards tonight fireworks game concludes saturday giveaway orioles knit cap 000 age actually looks baltimore orioles clinched american league east title division foe toronto blue jays september 1997 birds onto defeat seattle mariners alds sep 2014 baltimore usa baltimore orioles players celebrate clinching east title game toronto blue jays oriole park camden yards orioles game final regular season series camden yards tonight fireworks game concludes saturday giveaway orioles knit cap 000 age actually looks baltimore orioles clinched american league east title division foe toronto blue jays september 1997 birds onto defeat seattle mariners alds sep 2014 baltimore usa baltimore orioles baseman christian walker singles inning boston red sox oriole park camden yards mandatory credit supported beltway battle bipartisan dream washington baltimore world series jennifer steinhauersept 2014 continue reading main story share page continue reading baltimore orioles starting pitcher kevin gausman throws boston red sox inning baseball game friday sept 2014 baltimore photo patrick semansky adam jones hits homers lead baltimore orioles win boston red sox baltimore sun rookie christian walker third league game added mar 2014 baltimore usa baltimore orioles left fielder nelson cruz hits solo home run seventh inning day baseball game boston baltimore evan meek relieved ryan webb base gotten impression matter orioles won game probably matter sunday afternoon lost red sox 
2014/09/22,"['1', '0', '-3', '1', '30', '42', '15', '1', '1', '2', '14', '40', '30', '10', '2', '2', '0', '7', '10', '7']",sep 2014 baltimore usa baltimore orioles baseman christian walker singles inning boston red sox oriole park camden yards mandatory credit supported beltway battle bipartisan dream washington baltimore world series jennifer steinhauersept 2014 continue reading main story share page continue reading baltimore orioles starting pitcher kevin gausman throws boston red sox inning baseball game friday sept 2014 baltimore photo patrick semansky sep 2014 baltimore usa baltimore orioles baseman christian walker singles inning boston red sox oriole park camden yards mandatory credit supported beltway battle bipartisan dream washington baltimore world series jennifer steinhauersept 2014 continue reading main story share page continue reading baltimore orioles starting pitcher kevin gausman throws boston red sox inning baseball game friday sept 2014 baltimore photo patrick semansky adam jones hits homers lead baltimore orioles win boston red sox baltimore sun rookie christian walker third league game added mar 2014 baltimore usa baltimore orioles left fielder nelson cruz hits solo home run seventh inning day baseball game boston baltimore evan meek relieved ryan webb base gotten impression matter orioles won game probably matter sunday afternoon lost red sox sep 2014 baltimore usa baltimore orioles center fielder adam jones congratulated delmon hitting run home run fifth inning boston red final regular season home game camden yards baltimore orioles hump road bosox frank birds send themselves final time home win week left baseball regular season playoff spots getting locked vegas favorite win los angeles angels anaheim looking bet orioles pay 
2014/09/23,"['0', '0', '-4', '-1', '65', '70', '4', '0', '0', '0', '9', '77', '58', '10', '0', '1', '0', '9', '1', '5']",adam jones hits homers lead baltimore orioles win boston red sox baltimore sun rookie christian walker third league game added mar 2014 baltimore usa baltimore orioles left fielder nelson cruz hits solo home run seventh inning day baseball game boston baltimore evan meek relieved ryan webb base gotten impression matter orioles won game probably matter sunday afternoon lost red sox adam jones hits homers lead baltimore orioles win boston red sox baltimore sun rookie christian walker third league game added mar 2014 baltimore usa baltimore orioles left fielder nelson cruz hits solo home run seventh inning day baseball game boston baltimore evan meek relieved ryan webb base gotten impression matter orioles won game probably matter sunday afternoon lost red sox sep 2014 baltimore usa baltimore orioles center fielder adam jones congratulated delmon hitting run home run fifth inning boston red final regular season home game camden yards baltimore orioles hump road bosox frank birds send themselves final time home win week left baseball regular season playoff spots getting locked vegas favorite win los angeles angels anaheim looking bet orioles pay baltimore orioles starting pitcher wei yin chin reacts allowing fifth inning run double york yankees derek jeter orioles shutout loss mandatory credit joy absalon usa sportssince city baltimore football baltimore ravens super bowl rings contributed overall feel orioles baseball people 
2014/09/24,"['0', '0', '-3', '-1', '73', '53', '5', '1', '1', '0', '10', '56', '72', '9', '0', '2', '0', '7', '1', '4']",sep 2014 baltimore usa baltimore orioles center fielder adam jones congratulated delmon hitting run home run fifth inning boston red final regular season home game camden yards baltimore orioles hump road bosox frank birds send themselves final time home win week left baseball regular season playoff spots getting locked vegas favorite win los angeles angels anaheim looking bet orioles pay sep 2014 baltimore usa baltimore orioles center fielder adam jones congratulated delmon hitting run home run fifth inning boston red final regular season home game camden yards baltimore orioles hump road bosox frank birds send themselves final time home win week left baseball regular season playoff spots getting locked vegas favorite win los angeles angels anaheim looking bet orioles pay baltimore orioles starting pitcher wei yin chin reacts allowing fifth inning run double york yankees derek jeter orioles shutout loss mandatory credit joy absalon usa sportssince city baltimore football baltimore ravens super bowl rings contributed overall feel orioles baseball people sep 2014 bronx usa york yankees shortstop derek jeter reacts game front baltimore orioles catcher nick hundley yankee stadium orioles jones looks stretch singles doubles mandatory credit tommy gilligan usa sportsthe sport baseball crazy niceties people lose track nevertheless facet sep 2014 bronx usa york yankees shortstop derek jeter reacts game front baltimore orioles catcher nick hundley yankee stadium orioles supported baseball orioles yankees orioles power surge pushes yankees brink elimination david waldsteinsept 2014 continue reading main story share page 
2014/09/25,"['0', '1', '1', '1', '63', '43', '4', '0', '0', '0', '7', '60', '46', '6', '0', '1', '0', '5', '3', '4']",baltimore orioles starting pitcher wei yin chin reacts allowing fifth inning run double york yankees derek jeter orioles shutout loss mandatory credit joy absalon usa sportssince city baltimore football baltimore ravens super bowl rings contributed overall feel orioles baseball people baltimore orioles starting pitcher wei yin chin reacts allowing fifth inning run double york yankees derek jeter orioles shutout loss mandatory credit joy absalon usa sportssince city baltimore football baltimore ravens super bowl rings contributed overall feel orioles baseball people sep 2014 bronx usa york yankees shortstop derek jeter reacts game front baltimore orioles catcher nick hundley yankee stadium orioles jones looks stretch singles doubles mandatory credit tommy gilligan usa sportsthe sport baseball crazy niceties people lose track nevertheless facet sep 2014 bronx usa york yankees shortstop derek jeter reacts game front baltimore orioles catcher nick hundley yankee stadium orioles supported baseball orioles yankees orioles power surge pushes yankees brink elimination david waldsteinsept 2014 continue reading main story share page sep 2014 york usa york yankees shortstop derek jeter celebrates hitting walk single baltimore orioles ninth inning yankee stadium mandatory modicum sense history appreciated circumstances game tonight orioles fan yankees fan fan neither watch knowing pitch bat run throw meant supported baseball orioles yankees yankees miss consecutive postseasons time decades david waldsteinsept 2014 continue reading main story share page continue 
2014/09/26,"['0', '0', '-13', '1', '60', '61', '18', '0', '2', '0', '9', '62', '58', '10', '1', '0', '0', '8', '15', '2']",sep 2014 bronx usa york yankees shortstop derek jeter reacts game front baltimore orioles catcher nick hundley yankee stadium orioles jones looks stretch singles doubles mandatory credit tommy gilligan usa sportsthe sport baseball crazy niceties people lose track nevertheless facet sep 2014 bronx usa york yankees shortstop derek jeter reacts game front baltimore orioles catcher nick hundley yankee stadium orioles supported baseball orioles yankees orioles power surge pushes yankees brink elimination david waldsteinsept 2014 continue reading main story share page sep 2014 bronx usa york yankees shortstop derek jeter reacts game front baltimore orioles catcher nick hundley yankee stadium orioles jones looks stretch singles doubles mandatory credit tommy gilligan usa sportsthe sport baseball crazy niceties people lose track nevertheless facet sep 2014 bronx usa york yankees shortstop derek jeter reacts game front baltimore orioles catcher nick hundley yankee stadium orioles supported baseball orioles yankees orioles power surge pushes yankees brink elimination david waldsteinsept 2014 continue reading main story share page sep 2014 york usa york yankees shortstop derek jeter celebrates hitting walk single baltimore orioles ninth inning yankee stadium mandatory modicum sense history appreciated circumstances game tonight orioles fan yankees fan fan neither watch knowing pitch bat run throw meant supported baseball orioles yankees yankees miss consecutive postseasons time decades david waldsteinsept 2014 continue reading main story share page continue javascript deferred var twitter delicious buzz aim var print var javascript deferred masn adds orioles schedules hour special wednesday post pick cinderella team 2014 season easily argue baltimore orioles season ups historic moments orioles playoffs played future hall famer derek orioles north border final time season begin series regular season don hurt explosive time teams baltimore games start playoff baseball tonight game orioles blue jays probably game season orioles play teeniest tiniest chance top seed playoffs dependent angels getting swept supported baseball yankees orioles night hero else derek jeter drives winning run fitting farewell yankee stadium david waldsteinsept 2014 continue 
