06/24/2013,"[('More Bad News For Top Prospect Dylan Bundy', 'http://calltothepen.com/2013/06/24/more-bad-news-for-top-prospect-dylan-bundy/'), ('Gene Woodling - BR Bullpen - Baseball-Reference.com', 'http://www.baseball-reference.com/bullpen/Gene_Woodling'), ('University of Kansas Athletics - Baseball - In the Pros', 'http://www.kuathletics.com/sports/2013/6/24/BB_0624135500.aspx?path=baseball'), ('Talk:List of Baltimore Orioles awards - Wikipedia', 'https://en.wikipedia.org/wiki/Talk:List_of_Baltimore_Orioles_awards'), ('2012-13 NHL Scores | 6/24/2013 | FOX Sports', u'http://www.foxsports.com/nhl/scores?season=2012&date=2013-06-24'), ('Dan Connelly Baltimore Orioles \\xab CBS Baltimore', 'http://baltimore.cbslocal.com/2013/06/24/dan-connelly-baltimore-orioles/'), ('Baltimore Orioles offer buy one get one free tickets today ...', 'http://www.camdenchat.com/2013/6/24/4460260/baltimore-orioles-tickets-buy-one-get-one-free-cleveland-indians'), ('The Official Site of Minor League Baseball | MiLB.com \\u2026', u'http://www.milb.com/index.jsp?ymd=20130624&fext=.jsp&sid=milb'), (""MIA@SF: Redmond ejected arguing umpires' ruling - \\u2026"", 'http://www.youtube.com/watch?v=BjAJdPAwcQ0'), ('BAL@TOR: Izturis crushes a solo home run to right - \\u2026', 'http://www.youtube.com/watch?v=U9Zvm_z20h4')]"
06/25/2013,"[('Davis and Casilla Homer as Orioles Rally for Win - The New ...', 'http://www.nytimes.com/2013/06/26/sports/baseball/davis-hits-28th-homer-as-orioles-beat-indians.html'), ('CAL@NYY: Reggie homers in Yankee Stadium return', 'http://www.youtube.com/watch?v=F1M9tniZ7mc'), ('In Last, Astros Are Affecting the Race in the A.L. - The ...', 'http://www.nytimes.com/2013/06/25/sports/baseball/in-last-astros-are-affecting-the-race-in-the-al.html'), ('MIL@BAL: Brewers clinch AL East in season finale - \\u2026', 'http://www.youtube.com/watch?v=uY6i_7a9fKY'), ('Baltimore Orioles 6, Cleveland Indians 3: Chris Davis and ...', 'http://www.camdenchat.com/2013/6/25/4464880/mlb-scores-orioles-indians-recap-june-25-chris-davis-alexi-casilla-home-run'), (""'Family Ties' creator Goldberg dies at 68 - CNN.com"", 'http://www.cnn.com/2013/06/24/showbiz/celebrity-news-gossip/family-ties-gary-david-goldberg-dies/index.html'), ('Home Run Community Heroes | Tri-City ValleyCats Content', u'http://www.milb.com/content/page.jsp?ymd=20130625&content_id=51715452&fext=.jsp&sid=t577&vkey='), ('Jim Crow Is Dead. Long Live the Constitution ...', 'https://www.bloomberg.com/view/articles/2013-06-25/jim-crow-is-dead-long-live-the-constitution-'), ('Mayweather not thinking about breaking Marciano\\u2019s record ...', 'http://nypost.com/2013/06/25/mayweather-not-thinking-about-breaking-marcianos-record/'), ('MLB roundup: Brantley has 4 RBIs; Indians beat Orioles ...', 'http://redraiders.com/sports/2013-06-25/mlb-roundup-brantley-has-4-rbis-indians-beat-orioles')]"
06/26/2013,"[('WS Gm3: McNally the first pitcher with slam in Series ...', 'http://www.youtube.com/watch?v=TVwXX-Mj5P8'), ('Baltimore Orioles Organization: Payroll, Depth Charts ...', 'https://mlbreports.com/2013/06/26/balorg/'), ('Aaron Hernandez criminal cases timeline | FOX Sports', 'http://www.foxsports.com/nfl/story/aaron-hernandez-murder-case-timeline-051414'), (""Singer Bobby 'Blue' Bland dies at 83 - CNN.com"", 'http://www.cnn.com/2013/06/24/showbiz/bland-dead/index.html'), ('Orioles Injury News: Dylan Bundy to get Tommy John surgery ...', 'http://www.camdenchat.com/2013/6/26/4467530/orioles-injury-news-dylan-bundy-tommy-john-surgery'), ('Longtime Edgewood resident Stephen Moyer joins Sarasota ...', 'http://www.baltimoresun.com/news/maryland/harford/abingdon/ph-ag-steve-moyer-joins-sarasota-police-0626-20130626-story.html'), ('Selling you on Orioles baseball: One night of advertising ...', 'http://www.camdenchat.com/2013/6/26/4465130/masn-advertising-baltimore-orioles-tv-broadcast'), ('Con jonr\\xf3n de Casilla, Orioles vencen a Indios', 'https://www.yahoo.com/news/con-jonr-n-casilla-orioles-vencen-indios-000526463.html'), ('BAL@CLE: Hoiles blasts two slams in one game - YouTube', 'http://www.youtube.com/watch?v=vJKmS3wB-WA'), ('Mark Teixeira\\u2019s contract another expensive miscue for ...', 'http://mlb.nbcsports.com/2013/06/26/mark-teixeiras-contract-another-expensive-miscue-for-yankees/')]"
06/27/2013,"[(""Orioles' Bundy needs Tommy John surgery"", 'http://www.espn.com/mlb/story/_/id/9426384/baltimore-orioles-prospect-dylan-bundy-tommy-john-surgery'), ('Sources: A-Rod hoping to cash out for $114 M before MLB ...', 'http://www.nydailynews.com/sports/i-team/sources-a-rod-hoping-cash-114-m-mlb-nails-article-1.1383664'), (""Cal Ripken's son Ryan leaving South Carolina"", 'http://www.espn.com/college-sports/story/_/id/9429659/cal-ripken-son-ryan-leaving-south-carolina'), ('Orioles top prospect to have Tommy John surgery', 'https://www.usatoday.com/story/sports/mlb/orioles/2013/06/27/dylan-bundy-to-have-tommy-john-elbow-surgery/2465269/'), ('Pujols Propels Angels in 10th Inning Over Tigers - The New ...', 'http://www.nytimes.com/2013/06/28/sports/baseball/pujols-propels-angels-in-10th-inning-over-tigers.html'), ('Wildlife &amp; Habitat - Buffalo Lake - U.S. Fish and Wildlife ...', 'http://www.fws.gov/refuge/Buffalo_Lake/wildlife_and_habitat/index.html'), ('Ryan Ripken transferring from South Carolina to Indian ...', 'http://www.baltimoresun.com/sports/orioles/blog/bal-ryan-ripken-transferring-from-south-carolina-to-indian-river-state-college-20130627-story.html'), (""Bel Air's Chase Kalisz wins national title in 400 IM ..."", 'http://www.baltimoresun.com/sports/orioles/bs-sp-swimming-nationals-kalisz-0628-20130627-story.html'), ('hokiesports.com :: Baseball :: Chad Pinder', 'http://www.hokiesports.com/baseball/players/pinder_chad.html'), ('MLB in September [I LiVE For THiS] \\u2014 Nate McLouth \\u2026', 'http://www.youtube.com/watch?v=cfRwboMPggc')]"
06/28/2013,"[('Orioles 4, Yankees 3: Sabathia, in Bid for 200th Victory ...', 'http://www.nytimes.com/2013/06/29/sports/baseball/yankees-sabathia-in-bid-for-200th-victory-veers-from-dominating-to-defeated.html'), ('Overthinking it: Dylan Bundy, Elbow Injuries, and the ...', 'http://www.baseballprospectus.com/article.php?articleid=21067'), ('Cliff Mapes - BR Bullpen - Baseball-Reference.com', 'http://www.baseball-reference.com/bullpen/Cliff_Mapes'), ('McLouth homers as Orioles rally past Yankees', 'http://www.cbssports.com/mlb/gametracker/recap/MLB_20130628_NYY@BAL/mclouth-homers-as-orioles-rally-past-yankees'), (""Camden Chat Q&amp;A with ESPN's Alex Cora - Camden Chat"", 'http://www.camdenchat.com/2013/6/28/4475448/orioles-vs-yankees-espn-alex-cora-preview-questions'), ('Orioles 7, Indians 3: A Strange, Strange Rally - Camden Chat', 'http://www.camdenchat.com/2013/6/28/4473014/orioles-vs-indians-game-recap-score'), ('2 Cats &amp; A Fox Test Positive For Rabies In Baltimore City ...', 'http://baltimore.cbslocal.com/2013/06/28/2-cats-a-fox-test-positive-for-rabies-in-baltimore-city/'), ('Milwaukee Brewers Affiliates Scoreboard | MiLB.com ...', u'http://www.milb.com/scoreboard/index.jsp?sid=milb&org=158&ymd=20130628'), ('ValleyCats Fan Guide | Tri-City ValleyCats Content', u'http://www.milb.com/content/page.jsp?ymd=20130628&content_id=52060632&fext=.jsp&sid=t577&vkey='), ('Former Orioles Chris Hoiles Live On THE FAN \\xab CBS Baltimore', 'http://baltimore.cbslocal.com/2013/06/28/former-orioles-chris-hoiles-live-on-the-fan/')]"
06/29/2013,"[(""Orioles bash Yankees, 11-3, as rivals' role reversal ..."", 'http://www.baltimoresun.com/sports/orioles/bal-orioles-bash-yankees-as-rivals-role-reversal-continues-20130629-story.html'), ('Hoping a Yankees Revival Starts With a Loss', 'http://www.nytimes.com/2013/06/30/sports/baseball/hoping-a-yankees-revival-starts-with-a-loss.html'), ('An Embarrassing Loss, Even by the Yankees\\u2019 Recent ...', 'http://www.nytimes.com/2013/06/30/sports/baseball/an-embarrassing-loss-even-by-the-yankees-recent-standards.html'), ('Annual JMU Alumni Picnic and Orioles Game vs. the New \\u2026', 'https://www.jmu.edu/events/2013/06/29-alumni-picnic-and-orioles-game-vs-new-york-yankees.shtml'), ('Orioles Hold Baseball Clinic For 300 Kids \\xab CBS Baltimore', 'http://baltimore.cbslocal.com/2013/06/29/orioles-hold-baseball-clinic-for-300-kids/'), ('Orioles designate Travis Ishikawa for assignment; recall ...', 'http://www.baltimoresun.com/sports/orioles/blog/bal-orioles-designate-travis-ishikawa-for-assignment-will-recall-righthander-jair-jurrjens-as-extra-pen-20130629-story.html'), (""CC blows 3-0 lead as Yanks fall to O's, 4-3 - NY Daily News"", 'http://www.nydailynews.com/sports/baseball/yankees/cc-blows-3-0-lead-yanks-fall-o-4-3-article-1.1385692'), ('The Official Site of Minor League Baseball | MiLB.com \\u2026', u'http://www.milb.com/index.jsp?ymd=20130629&fext=.jsp&sid=milb'), ('Chris Davis hits 2 HRs as Orioles pound Yankees 11-3', 'http://www.usatoday.com/story/sports/mlb/2013/06/29/chris-davis-home-runs-baltimore-orioles-new-york-yankees/2476369/'), ('25 NFL Records That Will Never Be Broken', 'http://www.rantsports.com/nfl/2013/06/29/top-10-nfl-records-that-will-never-be-broken/')]"
06/30/2013,"[('Yankees vs. Orioles - newsday.com', 'http://www.newsday.com/sports/baseball/yankees/yankees-vs-orioles-1.5589789'), ('Fifth Straight Loss Drops Yankees to Fourth in A.L. East ...', 'http://www.nytimes.com/2013/07/01/sports/baseball/fifth-straight-loss-drops-yankees-to-fourth-in-al-east.html'), ('At Season\\u2019s Midpoint, Yankees Struggle to Score - The New ...', 'http://www.nytimes.com/2013/07/01/sports/baseball/at-seasons-midpoint-yankees-struggle-to-score.html'), ('Orioles acquire outfielder Eric Thames from Mariners ...', 'http://mlb.nbcsports.com/2013/06/30/orioles-acquire-outfielder-eric-thames-from-mariners/?partner=ya5nbcs'), ('Crush groove: Chris Davis on historic run for Orioles', 'https://www.usatoday.com/story/sports/mlb/orioles/2013/06/30/chris-davis-orioles-30-home-runs-crush-davis/2477927/'), ('Unimpressive Executive lounge - Review of Hilton Baltimore ...', 'https://www.tripadvisor.com/ShowUserReviews-g60811-d1147514-r165806402-Hilton_Baltimore-Baltimore_Maryland.html'), ('Davis hits 2 HRs as Orioles pound Yankees 11-3', 'https://www.yahoo.com/news/davis-hits-2-hrs-orioles-pound-yankees-11-021625351.html?ref=gs'), ('30 Major League Baseball logos reimagined by St ...', 'http://www.bizjournals.com/tampabay/blog/morning-edition/2013/06/30-major-league-baseball-logos.html'), ('2013 MLB Schedule 06/30/2013 | FOX Sports', u'http://www.foxsports.com/mlb/schedule?season=2013&date=2013-06-30&seasonType=1'), ('PHI@LAD: Schumaker pitches scoreless ninth inning', 'http://www.youtube.com/watch?v=R-6R4XuMrQM')]"
07/01/2013,"[('The Orioles Sweep The Yankees \\xab CBS Baltimore', 'http://baltimore.cbslocal.com/photo-galleries/2013/07/01/the-orioles-sweep-the-yankees/'), ('The 20 Greatest Doo-Wop Songs (1953-1964) - YouTube', 'http://www.youtube.com/watch?v=qfmhhBh_taU'), ('2013 MLB Schedule 07/01/2013 | FOX Sports', u'http://www.foxsports.com/mlb/schedule?season=2013&date=2013-07-01&seasonType=1'), ('Holiday Inn Baltimore-Inner Harbor - Hotel Reviews &amp; Price ...', 'https://www.tripadvisor.com/Hotel_Review-g60811-d89337-Reviews-or730-Holiday_Inn_Baltimore_Inner_Harbor-Baltimore_Maryland.html'), ('Great - Oriole Park at Camden Yards, Baltimore Traveller ...', 'https://www.tripadvisor.co.uk/ShowUserReviews-g60811-d104307-r165967471-Oriole_Park_at_Camden_Yards-Baltimore_Maryland.html'), ('Yankees Pinstripe plus | New York Post', 'http://nypost.com/2013/07/01/yankees-pinstripe-plus-3/'), ('Great Stay For Yankees Weekend - Review of Renaissance ...', 'https://www.tripadvisor.com/ShowUserReviews-g60811-d89358-r165901071-Renaissance_Baltimore_Harborplace_Hotel-Baltimore_Maryland.html'), ('Review of Hilton Baltimore - tripadvisor.com.au', 'https://www.tripadvisor.com.au/ShowUserReviews-g60811-d1147514-r166122853-Hilton_Baltimore-Baltimore_Maryland.html'), ('Catonsville girl dies during procedure to receive an ...', 'http://www.baltimoresun.com/news/maryland/baltimore-county/catonsville/bs-md-teresa-bartlinski-20130701-story.html'), ('New Md. Law Aims To Crack Down On Toll Scofflaws \\xab CBS ...', 'http://baltimore.cbslocal.com/2013/07/01/new-md-law-aims-to-crack-down-on-toll-scofflaws/')]"
07/02/2013,"[('Ahhh, Club Seats! - Review of Oriole Park at Camden Yards ...', 'https://www.tripadvisor.com/ShowUserReviews-g60811-d104307-r166076148-Oriole_Park_at_Camden_Yards-Baltimore_Maryland.html'), ('Former Orioles pitcher Jake Arrieta wins NL Cy Young Award', 'http://www.baltimoresun.com/sports/bal-former-orioles-pitcher-jake-arrieta-wins-nl-cy-young-award-20151118-story.html'), ('Orioles Trade Jake Arrieta and Pedro Strop to Cubs for ...', 'http://bleacherreport.com/articles/1691801-orioles-trade-jake-arrieta-and-pedro-stropm-to-cubs-for-scott-feldman'), ('Best Places For A Brazilian Blowout In The Baltimore Area ...', 'http://baltimore.cbslocal.com/top-lists/best-places-for-a-brazilian-blowout-in-the-baltimore-area/'), ('Grading Baltimore Orioles-Chicago Cubs Trade Sending \\u2026', 'http://bleacherreport.com/articles/1691823-grading-baltimore-orioles-chicago-cubs-trade-sending-scott-feldman-to-baltimore'), ('Red Sox pause while Orioles improve their pitching - The ...', 'https://www.bostonglobe.com/sports/2013/07/02/red-sox-pause-while-orioles-improve-their-pitching/6Tmmh9UUHDMTKrTNweuRrK/story.html'), ('Orioles strike first, trade for Cubs starter Feldman', 'http://www.usatoday.com/story/sports/mlb/orioles/2013/07/02/scott-feldman-orioles-cubs-trade/2483603/'), ('Orioles trade news: Jake Arrieta, Pedro Strop, and ...', 'http://www.camdenchat.com/2013/7/2/4487056/orioles-trade-jake-arrieta-pedro-strop-cubs-scott-feldman-steve-clevenger'), ('Report: MLB Umpire Let Go After Drug Violation', 'https://www.usatoday.com/story/sports/mlb/2013/07/02/mlb-baseball-umpire-brian-runge-drug-violation/2484859/'), ('One of the best baseball stadiums - Oriole Park at Camden ...', 'https://www.tripadvisor.co.uk/ShowUserReviews-g60811-d104307-r166077274-Oriole_Park_at_Camden_Yards-Baltimore_Maryland.html')]"
07/03/2013,"[('2007 Pan American Games - BR Bullpen', 'http://www.baseball-reference.com/bullpen/2007_Pan_American_Games'), ('Baltimore Orioles acquire Scott Feldman in deal with ...', 'http://www.espn.com/mlb/story/_/id/9444795/baltimore-orioles-acquire-scott-feldman-deal-chicago-cubs'), ('Baltimore Orioles No Hitter, Bob Milacki Mike Flanagan ...', 'http://www.youtube.com/watch?v=pcbT0hzjjQ8'), (""Kris Kross' Chris Kelly died from overdose, autopsy says ..."", 'http://www.cnn.com/2013/07/03/showbiz/chris-kelly-autopsy/index.html'), ('On Tuesday, the Orioles trade Jake Arrieta and Pedro Strop ...', 'http://www.baltimoresun.com/sports/baltimore-sports-blog/bal-sports-blitz-orioles-trade-jake-arrieta-20130703-story.html'), ('Cubs trade Feldman to Orioles, Marmol to Dodgers', 'https://www.yahoo.com/news/cubs-trade-feldman-orioles-marmol-dodgers-013113382.html?ref=gs'), ('Fernandez shows quick reflexes to grab liner - YouTube', 'http://www.youtube.com/watch?v=NeloljCx-1g'), (""Releases | PB's Fantasy Baseball"", 'http://pbfantasybaseball.proboards.com/board/63/releases'), ('Baseball Prospectus', 'http://www.baseballprospectus.com/author/john_perrotto/'), ('The Twins give Mariano Rivera the absolute best gift yet ...', 'http://mlb.nbcsports.com/2013/07/03/the-twins-give-mariano-rivera-the-absolute-best-gift-yet/')]"
07/04/2013,"[('Best Bars For Groups In Baltimore \\xab CBS Baltimore', 'http://baltimore.cbslocal.com/top-lists/best-bars-for-groups-in-baltimore/'), ('So you wanna work in baseball, huh? | HardballTalk', 'http://mlb.nbcsports.com/2013/07/04/so-you-wanna-work-in-baseball-huh/'), ('White Sox Win in 9th on Homer by Dunn', 'http://www.nytimes.com/2013/07/05/sports/baseball/white-sox-win-in-9th-on-homer-by-dunn.html'), ('Dundalk\\u2019s Fourth Of July Parade Is An Annual Family ...', 'http://baltimore.cbslocal.com/2013/07/04/dundalks-fourth-of-july-parade-is-an-annual-family-friendly-affair/'), ('7/2/13: Bailey overwhelms Giants for second no-hitter ...', 'http://www.youtube.com/watch?v=rs_sKwbZk7w'), ('New Hooded Oriole Feeder--They Like It - YouTube', 'http://www.youtube.com/watch?v=hWWWtgKMuWI'), ('Baltimore Orioles New Era MLB 2013 July 4th Stars ...', 'https://www.lids.com/baltimore-orioles-new-era-mlb-2013-july-4th-stars-stripes-59fifty-cap/20525450'), ('Brian Graham - BR Bullpen - Baseball-Reference.com', 'http://www.baseball-reference.com/bullpen/Brian_Graham'), ('The Impressive 2013 Orioles Should Be Sending 3 All ...', 'https://mlbreports.com/2013/07/04/bal3/'), ('Yankees Thrash Twins to Complete 4-Game Sweep', 'http://www.nytimes.com/2013/07/05/sports/baseball/yankees-thrash-twins-to-complete-4-game-sweep.html')]"
07/05/2013,"[('Davis, Drafted by Yankees, Breaks Out With Orioles - The ...', 'http://www.nytimes.com/2013/07/06/sports/baseball/davis-drafted-by-yankees-breaks-out-with-orioles.html'), ('Judge Temporarily Blocks Ocean City Noise Ordinance', 'http://baltimore.cbslocal.com/2013/07/05/judge-temporarily-blocks-ocean-city-noise-ordinance/'), ('Illegal fireworks cause two Harford building fires ...', 'http://www.baltimoresun.com/news/maryland/harford/aberdeen-havre-de-grace/ph-ag-illegal-fireworks-0710-20130705-story.html'), ('For Mets Draft Class, Dreams Didn\\u2019t Last Long in Minors ...', 'http://www.nytimes.com/2013/07/06/sports/baseball/for-mets-draft-class-dreams-didnt-last-long-in-minors.html'), ('Orioles closer Jim Johnson blows sixth save in loss to ...', 'http://www.baltimoresun.com/sports/orioles/bal-orioles-closer-jim-johnson-blows-sixth-save-in-loss-to-yankees-20130705-story.html'), ('Woman Drowns In Pool In Edgewater \\xab CBS Baltimore', 'http://baltimore.cbslocal.com/2013/07/05/woman-drowns-in-pool-in-edgewater/'), ('David Gray - ""You\'re The World To Me"" - YouTube', 'http://www.youtube.com/watch?v=KxDdEL4rwNA'), ('Vernon Wells, Ivan Nova help New York Yankees beat ...', 'https://www.thestar.com/sports/baseball/2013/07/05/vernon_wells_ivan_nova_help_new_york_yankees_beat_baltimore_orioles.html'), ('Sportswriter basically accuses Chris Davis of using PEDs ...', 'http://mlb.nbcsports.com/2013/07/05/sportswriter-basically-accuses-chris-davis-of-using-peds/'), ('Could Babe Ruth make the adjustment to today\\u2019s game ...', 'http://mlb.nbcsports.com/2013/07/05/could-babe-ruth-make-the-adjustment-to-todays-game/')]"
07/06/2013,"[('Yankees\\u2019 Jeter Enjoys Visit to Mountains but Hopes for ...', 'http://www.nytimes.com/2013/07/07/sports/baseball/yankees-jeter-enjoys-visit-to-mountains-but-hopes-for-short-stay.html'), ('The Athletics\\u2019 Sweet Smell of Victory - The New York Times', 'http://www.nytimes.com/2013/07/07/sports/baseball/the-athletics-sweet-smell-of-victory.html'), ('8 Baltimore Orioles on the Verge of Historic Achievements ...', 'http://bleacherreport.com/articles/1695156-eight-orioles-on-the-verge-of-historic-achievements'), ('Andy Pettitte ties Bob Gibson as Yankees edge Orioles', 'http://www.usatoday.com/story/sports/mlb/2013/07/06/yankees-beat-orioles-andy-pettitte-chris-davis/2495435/'), (""Botte: Mo, Cano likely Bombers' only All-Stars in 'stripes ..."", 'http://www.nydailynews.com/sports/baseball/yankees/botte-mo-cano-bombers-all-stars-stripes-article-1.1391563'), ('Wells\\u2019s Bases-Loaded Walkoff Carries Yankees Over Orioles ...', 'https://www.bloomberg.com/news/articles/2013-07-06/wells-s-bases-loaded-walkoff-carries-yankees-over-orioles-3-2'), ('Former Baltimore Oriole Catcher Chris Hoiles Joins Bruce ...', 'http://baltimore.cbslocal.com/2013/07/06/former-baltimore-oriole-catcher-chris-hoiles-joins-bruce-cunningham-to-discuss-the-state-of-the-team/'), ('Class A Short Season Scoreboard | MiLB.com Scoreboard ...', u'http://www.milb.com/scoreboard/index.jsp?sid=milb&sc=asx&ymd=20130706'), (""7/4/13: Dunn's walkoff gives White Sox win on Fourth \\u2026"", 'http://www.youtube.com/watch?v=IAxYDHRPKLw'), ('Four players to represent the Orioles on American League ...', 'http://articles.baltimoresun.com/2013-07-06/sports/bal-four-players-to-represent-the-orioles-on-american-league-allstar-team-20130706_1_first-baseman-chris-davis-adam-jones-manny-machado')]"
07/07/2013,"[('Yankees vs. Orioles | Newsday', 'http://www.newsday.com/sports/baseball/yankees/yankees-vs-orioles-1.5633020'), (""Orioles vs. Yankees Video: Watch Manny Machado's Unreal ..."", 'http://bleacherreport.com/articles/1696329-orioles-vs-yankees-video-watch-manny-machados-unreal-throw-vs-new-york'), ('Manny Machado Robs Luis Cruz Of Hit With Outstanding ...', 'http://www.huffingtonpost.com/2013/07/07/manny-machado-luis-cruz-throw-out-video_n_3558600.html'), ('Manny Machado 2013 Highlights - YouTube', 'http://www.youtube.com/watch?v=_aPXE-2g5Ws'), ('Orioles Davis Tops All-Stars, Cardinals Molina Is NL ...', 'https://www.bloomberg.com/news/articles/2013-07-07/orioles-davis-leads-all-star-voting-molina-tops-nl-correct-'), ('Computer mouse inventor Douglas Engelbart dies - CNN.com', 'http://www.cnn.com/2013/07/03/tech/mouse-inventor-dies/index.html'), (""Davis tops fan vote, O's have 3 All-Star starters"", 'https://www.yahoo.com/news/davis-tops-fan-vote-os-3-star-starters-225855134.html'), ('2013 All-Star Game -- Chris Davis of Baltimore Orioles ...', 'http://www.espn.com/mlb/allstar13/story/_/id/9455259/2013-all-star-game-chris-davis-baltimore-orioles-draws-most-fan-votes-start-all-star-game'), ('MLB All-Star Game: Latinos Dominate Starting Lineup', 'http://www.foxnews.com/sports/2013/07/07/mlb-all-star-game-latinos-dominate-starting-lineups.html'), ('Orioles acquire Alex Liddi from Mariners - MLB Daily Dish', 'http://www.mlbdailydish.com/2013/7/7/4500158/orioles-acquire-alex-liddi-from-mariners')]"
07/08/2013,"[('How To Buy Roof Deck Bar Stool Seats at Camden Yards', 'http://thebaltimorechop.com/2013/07/08/orioles-bar-stool-seats/'), ('Yankees\\u2019 Nova Acting and Pitching Like a King of the Mound ...', 'http://www.nytimes.com/2013/07/09/sports/baseball/yankees-nova-acting-and-pitching-like-a-king-of-the-mound.html'), (""Manny Machado's Top 10 Plays as a Baltimore Oriole ..."", 'http://www.bleacherreport.com/articles/1696642-manny-machados-top-ten-plays-as-an-oriole'), ('Rangers watch Chris Davis thrive in Baltimore', 'https://www.usatoday.com/story/sports/mlb/orioles/2013/07/08/rangers-watch-chris-davis-thrive-in-baltimore/2500829/'), ('Black Christians = Uncle Toms - YouTube', 'http://www.youtube.com/watch?v=vLwUA3CHumk'), ('Orioles\\u2019 Chris Davis Joins MLB Home Run Derby on Cano\\u2019s AL ...', 'https://www.bloomberg.com/news/articles/2013-07-08/orioles-davis-joins-cano-on-al-squad-for-mlb-s-home-run-derby'), (""Gino's closes King of Prussia location"", 'http://www.philly.com/philly/blogs/the-insider/Ginos-closes-KoP-location.html'), ('DET@CLE: Prince turns two in unassisted play - YouTube', 'http://www.youtube.com/watch?v=vfvelrAzTu8'), ('Wabash College Athletics - All-Star Baseball Series ...', 'http://sports.wabash.edu/news/2013/7/8/BB_0708134110.aspx'), ('Inside The Vikings Equipment Room', 'http://www.vikings.com/media-vault/videos/Inside-The-Vikings-Equipment-Room/42b2994c-1ade-433c-8fa9-a88cc723f878')]"
07/09/2013,"[('A New Life for the Mets Prospect Dominic Smith - The New ...', 'http://www.nytimes.com/2013/07/10/sports/baseball/a-new-life-for-the-mets-prospect-dominic-smith.html'), ('1977 ALCS, Game 5: Yankees, Royals fracas - YouTube', 'http://www.youtube.com/watch?v=vbdvlX1j77w'), ('Funny obits bring new life to a dying art - CNN.com', 'http://www.cnn.com/2013/07/06/living/viral-obits/index.html'), (""'Baseball Wives' Anna Benson in bulletproof vest breaks ..."", 'http://www.nydailynews.com/news/crime/baseball-wives-anna-benson-arrested-breaking-estranged-husband-kris-benson-house-article-1.1393203'), ('Rick Reilly basically accuses Chris Davis of PED use ...', 'http://www.sbnation.com/mlb/2013/7/9/4506612/ricky-reilly-chris-davis-PEDs-orioles'), ('Davis In Home Run Derby \\u2013 Navarro College Athletics', 'http://www.navarrocollege.edu/athletics/2013/07/09/davis-in-home-run-derby/'), ('Rangers vs. Orioles Wrapup | 07/09/13 | MLB.com', 'http://m.mlb.com/gameday/rangers-vs-orioles/2013/07/09/348091/final'), (""Jones' clutch homer puts O's up in ninth - YouTube"", 'http://www.youtube.com/watch?v=o8TnFiUz0W8'), ('Baltimore Orioles: Can They Return To The Playoffs?', 'http://fansided.com/2013/07/09/baltimore-orioles-can-they-return-to-the-playoffs/'), ('Oh my stars and garters, what if an All-Star tests ...', 'http://mlb.nbcsports.com/2013/07/09/oh-my-stars-and-garters-what-if-an-all-star-tests-positive-for-drugs/')]"
