08/13/2013,"[('Orioles vs. D-backs Wrapup | 08/13/13 | MLB.com', 'http://m.mlb.com/gameday/orioles-vs-d-backs/2013/08/13/348515/final'), ('NYM@ARI: Ross dislocates his hip running to first - \\u2026', 'http://www.youtube.com/watch?v=7VpS0T_kt2w'), ('Giants fan apologizes for throwing banana at Adam ... - CNN', 'http://www.cnn.com/2013/08/13/sport/orioles-jones-banana-incident/index.html'), ('MLB Recap - Baltimore Orioles at Arizona Diamondbacks ...', 'http://www.cbssports.com/mlb/gametracker/recap/MLB_20130813_BAL@ARI'), ('Baltimore Co. Woman Found Guilty Of First-Degree Murder ...', 'http://baltimore.cbslocal.com/2013/08/13/jury-to-decide-fate-of-baltimore-county-woman-who-hired-hitman-to-kill-husband/'), ('New York Yankees Affiliates Scoreboard | MiLB.com ...', u'http://www.milb.com/scoreboard/index.jsp?cid=&lid=&org=147&sc=&sid=milb&t=affiliate&ymd=20130813'), ('Chicago Cubs Affiliates Scoreboard | MiLB.com Scoreboard ...', u'http://www.milb.com/scoreboard/index.jsp?sid=milb&org=112&ymd=20130813'), ('5 Most Unbelievable MLB Contract Clauses and Incentives ...', 'http://www.bleacherreport.com/articles/1737051-5-most-unbelievable-mlb-contract-clauses-and-incentives'), (""With 'stop and frisk,' New Yorkers debate discrimination ..."", 'https://www.yahoo.com/news/stop-frisk-new-york-police-223815954.html'), ('Baseball ProGUESTus: The Neuroanatomy of Hitting ...', 'http://www.baseballprospectus.com/article.php?articleid=21510')]"
08/14/2013,"[('Orioles vs. D-backs Wrapup | 08/14/13 | MLB.com', 'http://m.mlb.com/gameday/orioles-vs-d-backs/2013/08/14/348530/final'), ('TEX@HOU: Pierzynski ejected after arguing in sixth - \\u2026', 'http://www.youtube.com/watch?v=jAim_zQGCHs'), ('MLB Most Amazing Catches - YouTube', 'http://www.youtube.com/watch?v=5KjeESI7VCk'), (""The Knuckleball Can Devastate, So Why Don't All Pitchers ..."", 'http://www.npr.org/sections/thetwo-way/2013/08/13/211667018/the-knuckleball-can-devastate-so-why-dont-all-pitchers-throw-it'), ('NFL players who also played baseball professionally', 'http://www.espn.com/mlb/story/_/id/9563548/nfl-players-played-baseball-professionally'), ('Atlanta Braves Affiliates Scoreboard | MiLB.com Scoreboard ...', u'http://www.milb.com/scoreboard/index.jsp?sid=milb&org=144&ymd=20130814'), ('D-backs rally to beat Orioles 4-3 in 11 innings | Sports ...', 'https://www.usnews.com/news/sports/articles/2013/08/14/d-backs-rally-to-beat-orioles-4-3-in-11-innings'), ('Cabrera\\u2019s Homer Powers Tigers Over White Sox - The New ...', 'http://www.nytimes.com/2013/08/15/sports/baseball/mlb-roundup.html'), ('Chris Curtis - BR Bullpen - Baseball-Reference.com - MLB ...', 'http://www.baseball-reference.com/bullpen/Chris_Curtis'), ('Power Ranking Every Starting Outfield in MLB', 'http://www.bleacherreport.com/articles/1733759-power-ranking-every-starting-outfield-in-mlb')]"
08/15/2013,"[('Ways to Watch Live TV on a Laptop or Tablet', 'http://www.nytimes.com/2013/08/15/technology/personaltech/ways-to-watch-live-tv-on-a-laptop-or-tablet.html'), ('Adam Jones and other Orioles have learned there are two ...', 'http://www.baltimoresun.com/sports/orioles/bs-sp-orioles-twitter-0816-20130815-story.html'), ('Really? MLB says replay will speed up pace of games', 'http://www.usatoday.com/story/sports/mlb/2013/08/15/bob-nightengale-mlb-instant-replay/2662897/'), ('Broken bat takes out Sogard - YouTube', 'http://www.youtube.com/watch?v=5mVj4P_l9Tc'), (""'Bachelor' contestant Gia Allemand dies in apparent ..."", 'http://www.cnn.com/2013/08/14/showbiz/gia-allemand-obit/index.html'), ('Backstop - BR Bullpen - Baseball-Reference.com - MLB Stats ...', 'http://www.baseball-reference.com/bullpen/Backstop'), (""The greatest flipping first pitch you've ever seen - \\u2026"", 'http://www.youtube.com/watch?v=6-FVIhWxKLg'), ('Across MLB, reaction is positive to expanded replay', 'http://www.usatoday.com/story/sports/mlb/2013/08/15/mlb-instant-replay-reaction-jed-lowrie-bob-melvin-joe-maddon-davey-johnson/2662997/'), ('Richard C. ""Dick"" Schneider, construction manager ...', 'http://www.baltimoresun.com/news/obituaries/bs-md-ob-richard-schneider-20130815-story.html'), ('Two Exciting New Sports Channels: FOX Sports 1 and FOX ...', 'http://news.directv.com/2013/08/15/two-exciting-new-sports-channels-fox-sports-1-and-fox-sports-2/')]"
08/16/2013,"[('Baltimore Orioles pitching coach Rick Adair on leave of ...', 'http://www.espn.com/mlb/story/_/id/9575122/baltimore-orioles-pitching-coach-rick-adair-leave-absence'), ('Orioles: Ain\\u2019t Nothin\\u2019 Workin\\u2019 - birdswatcher.com', 'http://birdswatcher.com/2013/08/16/baltimore-orioles-aint-nothin-workin/'), ('Popular Articles &amp; Stories for August 16, 2013 ...', 'http://articles.baltimoresun.com/2013/aug/16'), ('Orioles pitching coach Rick Adair taking a leave of ...', 'http://www.baltimoresun.com/sports/orioles/blog/bal-orioles-pitching-coach-rick-adair-taking-a-leave-of-absence-for-personal-reasons-20130816-story.html'), ('Orioles Announce Changes To Coaching Staff \\xab CBS Baltimore', 'http://baltimore.cbslocal.com/2013/08/16/orioles-announce-changes-to-coaching-staff/'), ('Rockies vs. Orioles Wrapup | 08/16/13 | MLB.com', 'http://m.mlb.com/gameday/rockies-vs-orioles/2013/08/16/348557/final'), ('Baltimore Design School Opens New Facility \\xab CBS Baltimore', 'http://baltimore.cbslocal.com/2013/08/16/baltimore-design-school-opens-new-facility/'), (""'92 NLCS, Gm 7 PIT@ATL: Bream beats Bonds' throw"", 'http://www.youtube.com/watch?v=FgjIVvEQo_o'), ('Baltimore Orioles Podcast: Camdencast Episode 50 - Jim ...', 'http://www.camdenchat.com/2013/8/16/4626940/baltimore-orioles-podcast-camdencast-jim-johnson'), ('Wofford College Athletics - Summer Baseball Recap', 'http://athletics.wofford.edu/news/2013/8/16/BB_0816131902.aspx')]"
08/17/2013,"[(""5. Will there be any changes in Buck Showalter's staff ..."", 'http://www.baltimoresun.com/sports/orioles/blog/bal-orioles-five-questions-2013-5-20130817-photo.html'), ('Rockies vs. Orioles Wrapup | 08/17/13 | MLB.com', 'http://m.mlb.com/gameday/rockies-vs-orioles/2013/08/17/348573/final'), ('Tejada Is Suspended for a Positive Drug Test - The New ...', 'http://www.nytimes.com/2013/08/18/sports/baseball/mlb-roundup.html'), (""Ranking the 10 Biggest 'One-Hit Wonders' in MLB History ..."", 'http://bleacherreport.com/articles/1741345-ranking-the-10-biggest-one-hit-wonders-in-mlb-history'), ('WAR is stupid, people are stupid (Or, Trout vs. Cabrera ...', 'http://mlb.nbcsports.com/2013/08/17/war-is-stupid-people-are-stupid-on-trout-vs-cabrera-debate/'), ('Jhoulys Chacin and Rockies lose to Orioles 7-2 \\u2013 The ...', 'http://www.denverpost.com/2013/08/17/jhoulys-chacin-and-rockies-lose-to-orioles-7-2/'), ('7 MLB Players Overrated by Misleading Statistics ...', 'http://www.bleacherreport.com/articles/1740699-7-mlb-players-overrated-by-misleading-statistics'), ('Matt Fitzpatrick advances to US Amateur final - The Boston ...', 'https://www.bostonglobe.com/sports/2013/08/17/matt-fitzpatrick-advances-amateur-final/pGKmcxcddR24pPh4y6uUxK/story.html'), (""Miguel Cabrera's walk-off homer lifts Tigers over Royals"", 'http://www.usatoday.com/story/sports/mlb/2013/08/17/miguel-cabrera-walk-off-home-run-tigers-beat-royals/2668295/'), ('Baltimore Colts Marching Band - Sundays at 2:00 - \\u2026', 'http://www.youtube.com/watch?v=HOjuV9rFQJU')]"
08/18/2013,"[('Davis, Jones power Orioles past Rockies 7-2 | Sports News ...', 'https://www.usnews.com/news/sports/articles/2013/08/18/davis-jones-power-orioles-past-rockies-7-2'), ('Sogard makes three amazing plays in one inning - \\u2026', 'http://www.youtube.com/watch?v=sW-NM31ohaw'), ('Brooklyn Tip-Tops all-time roster - Wikipedia', 'https://en.wikipedia.org/wiki/Brooklyn_Tip-Tops_all-time_roster'), ('Buffalo Blues all-time roster - Wikipedia', 'https://en.wikipedia.org/wiki/Buffalo_Blues_all-time_roster'), ('Rockies vs. Orioles Wrapup | 08/18/13 | MLB.com', 'http://m.mlb.com/gameday/rockies-vs-orioles/2013/08/18/348587/final'), ('New Hampshire woman fired after fight with employers over ...', 'https://www.bostonglobe.com/lifestyle/health-wellness/2013/08/18/new-hampshire-woman-fired-after-fight-with-employers-over-breast-feeding/HpoMceGCBxojIyK2nrFRNJ/story.html'), ('Chicago Cubs Affiliates Scoreboard | MiLB.com Scoreboard ...', u'http://www.milb.com/scoreboard/index.jsp?sid=milb&org=112&ymd=20130818'), ('Baltimore Tourism Reaching New Heights \\xab CBS Baltimore', 'http://baltimore.cbslocal.com/2013/08/18/baltimore-tourism-reaching-new-heights/'), ('Tejada suspended 105 games for amphetamines | Fox News', 'http://www.foxnews.com/sports/2013/08/17/tejada-suspended-105-games-for-amphetamines.html'), (""Rickey Henderson's mascot won the A's mascot race and the ..."", 'http://wapc.mlb.com/cutfour/2013/08/18/57392742/rickey-henderson-mascot-wins-race-real-rickey-celebrates')]"
08/19/2013,"[('Rodriguez\\u2019s Lawyer Calls Baseball\\u2019s Offer a \\u2018Trap\\u2019 - The ...', 'http://www.nytimes.com/2013/08/20/sports/baseball/rodriguezs-lawyer-calls-baseballs-offer-a-trap.html'), (""A-Rod's lawyer ambushed on Today Show"", 'http://www.espn.com/blog/new-york/yankees/post/_/id/62690/tacopina-ambushed-on-the-today-show'), ('A-Rod hit by Dempster, answers with big game - \\u2026', 'http://www.youtube.com/watch?v=FfV1gznyCUQ'), ('Rays vs. Orioles Wrapup | 08/19/13 | MLB.com', 'http://m.mlb.com/gameday/rays-vs-orioles/2013/08/19/348605/final'), (""SB Nation's top 100 NBA players of 2017 - SBNation.com"", 'http://www.sbnation.com/2013/8/19/4615826/top-100-nba-players-2017-list'), (""Umpire Brian O'Nora makes call while injured - YouTube"", 'http://www.youtube.com/watch?v=lfb5dsmDzGA'), ('Rays 4, Orioles 3: Price escapes four jams; Longoria ...', 'http://www.draysbay.com/2013/8/19/4638256/rays-4-orioles-3-price-escapes-four-jams-longoria-joyce-hr'), ('Orioles leave 15 runners on base, lose to the Rays 4-3 ...', 'http://www.baltimoresun.com/sports/orioles/bal-orioles-leave-15-runners-on-base-lose-to-the-rays-43-20130819-story.html'), (""Uni Watch Power Rankings rates MLB's uniforms from 1-30"", 'http://www.espn.com/mlb/story/_/id/12374140/uni-watch-power-rankings-rates-mlb-uniforms-1-30'), (""Rocky's Reading Challenge | Wilmington Blue Rocks Content"", u'http://www.milb.com/content/page.jsp?ymd=20130819&content_id=57493884&fext=.jsp&sid=t426&vkey=')]"
08/20/2013,"[('Tampa Bay Edges Baltimore in A.L. East Matchup', 'http://www.nytimes.com/2013/08/20/sports/baseball/mlb-roundup.html'), ('Longoria, Joyce hit HRs as Rays beat Orioles 4-3', 'https://www.yahoo.com/news/longoria-joyce-hit-hrs-rays-beat-orioles-4-030910186.html?ref=gs'), ('Washington Native Plant Society: Starflower Image Herbarium', 'http://www.wnps.org/landscaping/herbarium/hummingbirdlist.html'), ('MLB Franchise Power Rankings: Who Is the Greatest of All ...', 'http://bleacherreport.com/articles/1742559-mlb-franchise-power-rankings-who-is-the-greatest-of-all-time'), (""Orioles' Chris Davis on Aug. 26 regional cover of Sports ..."", 'https://www.si.com/mlb/strike-zone/2013/08/20/orioles-chris-davis-on-aug-26-regional-cover-of-sports-illustrated'), ('Dempster hits A-Rod, Girardi ejected - YouTube', 'http://www.youtube.com/watch?v=Ngqeyfutg54'), ('Rays vs. Orioles Wrapup | 08/20/13 | MLB.com', 'http://m.mlb.com/gameday/rays-vs-orioles/2013/08/20/348619/final'), (""Kevin Plank, Under Armour's Founder - Interview and ..."", 'http://www.mensjournal.com/magazine/kevin-plank-the-man-under-the-armour-20130820'), ('MLB Recap - Tampa Bay Rays at Baltimore Orioles - Aug 20 ...', 'http://www.cbssports.com/mlb/gametracker/recap/MLB_20130820_TB@BAL/rays-get-sixth-win-in-seven-games-top-skidding-orioles'), ('Baltimore Orioles Opening Day - YouTube', 'http://www.youtube.com/watch?v=qOu6wmKkwYI')]"
08/21/2013,"[('2014 SEC football schedule here, including out-of ...', 'http://www.sbnation.com/college-football/2013/8/21/4643368/sec-football-schedule-2014'), ('Sid Bernstein, who brought The Beatles to U.S., dies - CNN.com', 'http://www.cnn.com/2013/08/21/showbiz/sid-bernstein-obit/index.html'), ('Orioles playoff hopes: How do the stars need to align for ...', 'http://www.camdenchat.com/2013/8/21/4642178/baltimore-orioles-playoff-picture-wild-card-al-east'), ('Rays vs. Orioles Wrapup | 08/21/13 | MLB.com', 'http://m.mlb.com/gameday/rays-vs-orioles/2013/08/21/348634/final'), ('BaseballAmerica.com: Stats', u'http://www.baseballamerica.com/statistics/leagues/box/?lg_id=16&tm1=3081&tm2=3311&sbd=20130821&gc=1'), ('Class A Advanced Scoreboard | MiLB.com Scoreboard | The ...', u'http://www.milb.com/scoreboard/index.jsp?sid=milb&sc=afa&ymd=20130821'), ('Fallston Patch (@FallstonMDPatch) | Twitter', 'https://twitter.com/FallstonMDPatch'), ('Giants rally past Red Sox, Rays take AL East lead', 'http://www.usatoday.com/story/sports/mlb/2013/08/21/san-francisco-giants-boston-red-sox-tampa-bay-rays-al-east/2680053/'), ('Brothers balks twice in same at-bat - YouTube', 'http://www.youtube.com/watch?v=jEmmenaEjOM'), ('MLB Top Plays 2013 Part 3 - YouTube', 'http://www.youtube.com/watch?v=9sLHLBngYII')]"
08/22/2013,"[('And now for some Orioles getting owned in ping pong by ...', 'http://wapc.mlb.com/cutfour/2013/08/22/57930218/and-now-for-some-orioles-getting-owned-in-ping-pong-by-children'), ('Villanueva freezes Werth with 57-mph pitch - YouTube', 'http://www.youtube.com/watch?v=kAv5R3SOQUw'), ('Ranking the Top 25 Players in Orlando Magic History ...', 'http://bleacherreport.com/articles/1741092-ranking-the-top-25-players-in-orlando-magic-history'), ('Sal\\xf3n de la Fama - BR Bullpen', 'http://www.baseball-reference.com/bullpen/Sal%C3%B3n_de_la_Fama'), ('White Sox, Red Sox throw down after George Bell hit by ...', 'http://www.youtube.com/watch?v=Sw_YlPTsFqY'), (""Elvis Andrus' walk-off sac fly puts Rangers over Astros"", 'http://www.usatoday.com/story/sports/mlb/rangers/2013/08/22/texas-rangers-houston-astros-elvis-andrus-al-west/2683821/'), ('John H. ""Jack"" Laporte Jr., T. Rowe Price portfolio manager', 'http://www.baltimoresun.com/news/obituaries/bs-md-ob-john-laporte-20130822-story.html'), ('Cal Ripken Jr. doesn\\u2019t rule out managing', 'http://www.washingtonpost.com/news/early-lead/wp/2013/08/22/cal-ripken-jr-doesnt-rule-out-managing/'), ('Baseball Prospectus | Overthinking It: Scouting Closers in ...', 'http://www.baseballprospectus.com/article.php?articleid=21600'), ('Missing Pasadena Woman Identified As Hit-And-Run Victim ...', 'http://baltimore.cbslocal.com/2013/08/22/missing-pasadena-woman-identified-as-hit-and-run-victim/')]"
08/23/2013,"[('2015 Buffalo Wing Festival | Buffalo Bisons Game Promotions', u'http://www.milb.com/content/page.jsp?ymd=20130823&content_id=58052514&fext=.jsp&sid=t422&vkey=team3'), ('Orioles trade Freddy Garcia to Atlanta Braves for cash ...', 'http://www.baltimoresun.com/sports/orioles/blog/bal-orioles-trade-freddy-garcia-to-braves-for-cash-20130823-story.html'), ('Puig attempts to come home on hit-by-pitch - YouTube', 'http://www.youtube.com/watch?v=aR1PlNOxg2I'), ('Digest: Good Counsel football coach Bob Milloy retires ...', 'http://www.baltimoresun.com/sports/high-school/football/bs-sp-digest-0216-20170211-story.html'), ('Orioles get crushed by kids in ping-pong - YouTube', 'http://www.youtube.com/watch?v=bFwLdzlv75U'), ('MLB Recap - Oakland Athletics at Baltimore Orioles - Aug ...', 'http://www.cbssports.com/mlb/gametracker/recap/MLB_20130823_OAK@BAL/roberts-grand-slam-helps-orioles-gain-in-wildcard-hunt'), ('Athletics vs. Orioles Wrapup | 08/23/13 | MLB.com', 'http://m.mlb.com/gameday/athletics-vs-orioles/2013/08/23/348654/final'), ('Mystery gnome homes appear along trail in Kansas - Yahoo', 'https://www.yahoo.com/news/blogs/sideshow/mystery-gnome-homes-appear-along-trail-in-kansas--205523557.html'), (""Orioles outslug A's to gain in wild-card race"", 'https://www.usatoday.com/story/sports/mlb/2013/08/23/orioles-outslug-athletics-gain-ground-wild-card-race/2694715/'), ('UPDATE: Athletics reacquire catcher Kurt Suzuki from ...', 'http://mlb.nbcsports.com/2013/08/23/report-athetics-reacquire-catcher-kurt-suzuki-from-nationals/')]"
08/24/2013,"[('www.fangraphs.com', u'http://www.fangraphs.com/boxscore.aspx?date=2013-08-24&team=Orioles&dh=0&season=2013'), ('Behind Lester, Red Sox Snap Dodgers\\u2019 Winning Streak - The ...', 'http://www.nytimes.com/2013/08/25/sports/baseball/mlb-roundup.html'), (""Coco Crisp homers off Darren O'Day in 9th inning as A's ..."", 'http://www.baltimoresun.com/sports/orioles/bal-orioles-athletics-20130824-story.html'), ('Athletics vs. Orioles Wrapup | 08/24/13 | MLB.com', 'http://m.mlb.com/gameday/athletics-vs-orioles/2013/08/24/348672/final'), ('MLB Recap - Oakland Athletics at Baltimore Orioles - Aug ...', 'http://www.cbssports.com/mlb/gametracker/recap/MLB_20130824_OAK@BAL'), (""Orioles' Kevin Gausman could be called up sooner than Sept ..."", 'http://www.baltimoresun.com/sports/orioles/blog/bal-orioles-kevin-gausman-could-be-called-up-sooner-than-sept-1-20130824-story.html'), ('Great ball park - Oriole Park at Camden Yards, Baltimore ...', 'https://www.tripadvisor.co.uk/ShowUserReviews-g60811-d104307-r173878372-Oriole_Park_at_Camden_Yards-Baltimore_Maryland.html'), ('Gulf Coast League Scoreboard | MiLB.com Scoreboard | The ...', u'http://www.milb.com/scoreboard/index.jsp?cid=&lid=124&org=&sc=&sid=milb&t=league&ymd=20130824'), ('Orioles derrotan 9-7 a los Atl\\xe9ticos', 'https://www.yahoo.com/news/orioles-derrotan-9-7-los-atl-ticos-025131119.html?ref=gs'), ('Under Armour no longer title sponsor of Baltimore Running ...', 'http://www.bizjournals.com/baltimore/news/2013/08/24/under-armour-baltimore-running-festival.html')]"
08/25/2013,"[('A\\u2019s prepare to be without injured Josh Reddick \\u2013 The ...', 'http://www.mercurynews.com/2013/08/25/as-prepare-to-be-without-injured-josh-reddick/'), ('Orioles Overpower Athletics as Wild-Card Race Tightens ...', 'http://www.nytimes.com/2013/08/26/sports/football/mlb-roundup.html'), ('Orioles power past Oakland, 10-3, in series finale ...', 'http://www.baltimoresun.com/sports/orioles/bal-orioles-power-past-oakland-103-in-series-finale-20130825-story.html'), ('Athletics vs. Orioles Wrapup | 08/25/13 | MLB.com', 'http://m.mlb.com/gameday/athletics-vs-orioles/2013/08/25/348685/final'), ('Cobb, Rays shoot for sweep of Yankees | Fox News', 'http://www.foxnews.com/sports/2013/08/25/cobb-rays-shoot-for-sweep-yankees.html'), ('Orioles 10, Athletics 3: Nick Markakis doubles and homers ...', 'http://www.camdenchat.com/2013/8/25/4657800/orioles-10-athletics-3-nick-markakis-doubles-and-homers-in-win-j-j'), ('American Baseball News - Android Apps on Google Play', 'https://play.google.com/store/apps/details?id=com.fflabs.mlbnews'), ('Peyton Manning, John Elway, John Lynch and Chauncey ...', 'http://www.foxnews.com/sports/2013/08/25/peyton-manning-john-elway-john-lynch-and-chauncey-billups-team-up-for-bmw.html'), ('Orioles cruise past Athletics in 10-3 win', 'http://www.usatoday.com/story/sports/mlb/2013/08/25/orioles-cruise-past-athletics/2697285/'), ('Producers: Goat Meat A Hot Product \\xab CBS Baltimore', 'http://baltimore.cbslocal.com/2013/08/25/producers-goat-meat-a-hot-product/')]"
08/26/2013,"[('A Season of Wonder, and Now a Future in Doubt - The New ...', 'http://www.nytimes.com/2013/08/27/sports/baseball/with-harvey-fans-still-waiting-to-exhale.html'), (""Orioles' Dan Duquette and Buck Showalter considering many ..."", 'http://www.baltimoresun.com/sports/orioles/bal-orioles-considering-many-options-to-add-depth-in-september-20130826-story.html'), (""Peter Angelos 'feels the sting' after 20 years as oft ..."", 'http://www.bizjournals.com/baltimore/news/2013/08/26/peter-angelos-feels-the-sting-after.html'), ('Parent ejected while exchanging lineup cards - YouTube', 'http://www.youtube.com/watch?v=OW8QYntn8tg'), ('The complicated Peter Angelos - SportsBusiness Daily ...', 'http://www.sportsbusinessdaily.com/Journal/Issues/2013/08/26/Franchises/Peter-Angelos.aspx'), ('MLB Trade Rumors: Updates on Waiver-Wire Buzz, Week of ...', 'http://bleacherreport.com/articles/1751360-mlb-trade-rumors-updates-on-waiver-wire-buzz-week-of-august-26'), ('Team One Baseball - 2013 Kelly Kulina Classic - Scouting Blog', 'http://www.teamonebaseball.com/press/1547/'), ('Peter Schmuck grades the Baltimore Orioles (Week 22 ...', 'http://www.baltimoresun.com/sports/schmuck-blog/bal-peter-schmuck-grades-the-baltimore-orioles-week-22-20130826-photogallery.html'), ('MLB on Yahoo! Sports - News, Scores, Standings, Rumors ...', 'http://sports.yahoo.com/mlb/scoreboard/?d=2013-08-26'), ('Pillar gets first career homer after replay - YouTube', 'http://www.youtube.com/watch?v=k9MbWxJeU0U')]"
08/27/2013,"[('Marshawn Lynch Running Toward Seahawks History \\xab CBS Baltimore', 'http://baltimore.cbslocal.com/2013/08/27/marshawn-lynch-running-toward-seahawks-history/'), ('As Game Changes, Science Can Lengthen a Pitcher\\u2019s Career', 'http://www.nytimes.com/2013/08/28/sports/baseball/as-calculus-of-pitching-changes-knowledge-can-affect-longevity.html'), ('Grand Prix Of Baltimore: The Boom From The Zoom Can \\u2026', 'http://baltimore.cbslocal.com/2013/08/27/grand-prix-of-baltimore-the-boom-from-the-zoom-can-cause-hearing-damage/'), ('Orioles vs. Red Sox Wrapup | 08/27/13 | MLB.com', 'http://m.mlb.com/gameday/orioles-vs-red-sox/2013/08/27/348703/final'), (""Orioles' 5-run ninth not enough after another lackluster ..."", 'http://www.baltimoresun.com/sports/orioles/bal-orioles-5run-ninth-not-enough-after-another-lackluster-pitching-effort-in-76-loss-to-detroit-tigers-20140405-story.html'), ('Orioles activate Wilson Betemit, send Ryan Flaherty to ...', 'http://www.baltimoresun.com/sports/orioles/blog/bal-orioles-activate-wilson-betemit-send-ryan-flaherty-to-frederick-20130827-story.html'), ('Baseball looks to protect catchers | Fox News', 'http://www.foxnews.com/sports/2013/08/27/baseball-looks-to-protect-catchers.html'), ('Orioles could be a factor in Red Sox\\u2019 stretch run - The ...', 'https://www.bostonglobe.com/sports/2013/08/27/orioles-could-factor-red-sox-stretch-run/zuIxIk8oYeYBLGtcIK4vwN/story.html'), ('Pirates acquire Marlon Byrd, John Buck from Mets', 'http://www.usatoday.com/story/sports/mlb/2013/08/27/pirates-mets-trade-marlon-byrd-john-buck/2708903/'), ('Boston Red Sox beat Baltimore Orioles - Boston.com', 'http://archive.boston.com/sports/baseball/redsox/2013/08/27/boston-red-sox-beat-baltimore-orioles/DIRtolNS1ShNoQIBOoVEOI/story.html')]"
08/28/2013,"[('Josh Willingham claimed on waivers by the Orioles ...', 'http://mlb.nbcsports.com/2013/08/28/josh-willingham-claimed-on-waivers-by-unknown-team/'), ('Rick Dempsey (@RickDempsey24) | Twitter', 'https://twitter.com/RickDempsey24'), ('Baltimore Sports and Novelty Ravens and Orioles gear ...', 'http://www.baltimoresun.com/news/maryland/baltimore-county/owings-mills/ph-owings-mills-baltimore-sports-novelty-pictures-20130828-photogallery.html'), ('Orioles Pregame Table Tennis 8/21/13 v. Tampa Bay - \\u2026', 'http://www.youtube.com/watch?v=2PL345PlZvg'), ('Victorino\\u2019s Home Runs Help Power Red Sox Past the Orioles ...', 'http://www.nytimes.com/2013/08/28/sports/baseball/mlb-roundup.html'), ('Probable Pitchers | MLB.com', u'http://mlb.mlb.com/news/probable_pitchers/index.jsp?c_id=mlb&date=2013/08/28'), (""Projecting Whether These Baltimore O's Players Can Make ..."", 'http://bleacherreport.com/articles/1751421-projecting-whether-these-baltimore-os-players-can-make-the-hall-of-fame'), ('Peter Angelos creates a new Oriole Way - Baltimore ...', 'http://www.bizjournals.com/baltimore/news/2013/08/28/peter-angelos-creates-a-new-oriole-way.html'), ('Kevin Gausman a reliever for now, but Orioles still view ...', 'http://www.baltimoresun.com/sports/orioles/blog/bs-sp-orioles-notes-0829-20130828-story.html'), ('Davis Hits 47th Homer But Orioles Lose To Red Sox \\xab CBS ...', 'http://baltimore.cbslocal.com/2013/08/28/red-sox-defeat-orioles-4-3/')]"
08/29/2013,"[('Orioles vs. Red Sox Wrapup | 08/29/13 | MLB.com', 'http://m.mlb.com/gameday/orioles-vs-red-sox/2013/08/29/348733/final'), ('Orioles silence Red Sox, 3-2 - Red Sox - Boston.com', 'http://archive.boston.com/sports/baseball/redsox/2013/08/29/orioles-silence-red-sox/HSdzdPdRoZecQryVTvpVRP/story.html'), ('IOWA HIGH SCHOOLS, MASCOTS &amp; CONFERENCE, \\u2026', 'http://www.iahsaa.org/wp-content/uploads/2013/02/Sch_conf_mascot_1314.pdf'), (""Boston Red Sox broadcaster Jerry Remy won't return this ..."", 'http://www.espn.com/mlb/story/_/id/9614431/boston-red-sox-broadcaster-jerry-remy-return-year-son-arrest'), ('Orioles trying to work out a trade after claiming Michael ...', 'http://www.baltimoresun.com/sports/orioles/blog/bal-orioles-trying-to-work-out-a-trade-after-claiming-michael-morse-and-josh-willingham-20130829-story.html'), ('25 Most Beautiful Women in Sports - RantSports', 'http://www.rantsports.com/clubhouse/2013/08/29/15-most-beautiful-women-in-sports/'), ('Peter Angelos is in no hurry to create an Orioles ...', 'http://www.bizjournals.com/baltimore/news/2013/08/29/peter-angelos-is-in-no-hurry-to-create.html'), ('Red Sox starter Jon Lester just a bit off vs. Orioles ...', 'https://www.bostonglobe.com/sports/2013/08/29/red-sox-starter-jon-lester-just-bit-off-orioles/R7VAoSoMe83X2eDqGjGG1N/story.html'), ('1998 WS Gm4: Rivera saves games, Yanks win series', 'http://www.youtube.com/watch?v=XV1wnKBbYnw'), ('10 Foods That Make You Sleepy - Sleep Inducing Foods', 'http://www.goodhousekeeping.com/health/diet-nutrition/g796/sleep-inducing-foods/')]"
